id,title,file_id,price
6628,"Brand New- DC Comics Girls ""I Love Batman"" Shirt (size 6X)",6628,46.67
11489,Hanna ANDERSSON Girls Cotton Tunic Top size 130 ( US 8 )  Floral NEW ,11489,29.86
12797,GRANDMA'S LITTLE PRINCESS T SHIRT YOUTH LARGE NEW WITH TAG,12797,22.38
10698,All I do is win girls size 4/5 purple Performance shirt,10698,22.42
4845,"Beautees Girls' X-Back Lace High-Low Top, Lilac, Size M, MSRP $34",4845,59.75
10872,Little Girls' Toddler Basic Short Sleeve Layering Tee 4T - The Children's Place,10872,24.74
13023,Girl's Converse ALL STAR Teal Sneaker T-Shirt Sz 13-15 New w Tags,13023,52.31
12771,Kensie Girl's Short Sleeve Basic Crochet Trim Shirt AB4 Neon Yellow Size 5-6 NWT,12771,26.87
7849,Freeze 24-7 Juniors Pokemon Pikachu T Shirt White womens New With Tags #3500 TFI,7849,41.74
4356,Ralph Lauren Girls Short Sleeve Southwestern Graphic Tee Carlyle Blue Sz 6X-NWT,4356,56.01
4482,"Epic Threads Girls' Eyelet Top, Bright White, Size M",4482,56.01
11461,"NWT Girls Short Sleeve ""That Was Major"" Shirt Size M 8",11461,14.91
7367,NWT Girls Short Sleeve Flowered Minnie Mouse Shirt Size XS (4/5),7367,33.59
7310,Carter's Pink Floral Lace Tee T-Shirt Top Short Sleeved Shirt Girl Size 5 NWT,7310,48.54
9496,IZ Amy Byer Girls Peacock  Blue Falling Sequin Knit Top Size large (14) NWT,9496,112.1
8474,Champion Girls Pink Multi-color V-Neck Duo Dry UV Protection T-Shirt. XS  4-5,8474,33.59
8077,"DISNEY STORE PINK PRINCESS ROYAL COURT ARIEL,BELLE,CINDERELLA,SNOW L10/12 NEW",8077,49.29
12553,"NEW GIRL'S PURPLE SHORT SLEEVE HOOTERS EMOTIONS T-SHIRT FT MYERS BEACH FL. S,M,L",12553,26.04
7346,GAP Kids Flutter Sleeve Embroidered Shirt Top w Embellished Sequin XS 4 5 NWT$25,7346,53.77
11768,"NEW NWT Girls Monster High ""Ghouls Rule"" Glitter T-Shirt SZ7/8",11768,37.33
8399,Paper Doll Purple T-Shirt - Size L/14,8399,14.95
2148,Gap Kids Future Astronaut Black Panda Sparkle Graphic Short Sleeve Tee Shirt 6 7,2148,52.2
5199,Harry Potter I solemnly Swear I am up to No Good Ruffle Sleeve Girls 14 Kids,5199,48.54
13588,Polo Ralph Lauren Girls Turquoise T-Shirt Top - Size 4 - NWT,13588,36.96
3350,TWISTED SISTER Juniors Girls Kids Short Sleeve T-Shirt BLACK NOT GONNA TAKE IT,3350,78.43
3896,NEW Girl's EDDIE BAUER White 3 S/S Basic T-Shirts Size Large L 10/12,3896,44.69
14415,Roxy Kids Sz 5 Shirts Tops Criss Cross Red,14415,59.75
1603,New Nike Federation Soccer Training DRI-FIT SS Shirt Girl's Large Green 413183,1603,68.72
571,"NEW 7th BIRTHDAY ""I am 7"" Years Girls Graphic Shirt 10-12 Large Gift! Cute SS",571,72.83
13370,Girls Disney Parks Frozen Top Shirt Elsa Anna Olaf Size 4 NWT,13370,29.89
2805,The North Face Boys SS White Black Logo T Shirt XL (18-20) NWT,2805,52.28
12586,Hello Kitty Red  Christmas NWT Graphic Short Sleeve Tee T Shirt Girls XS 4/5,12586,18.68
15368,Cat and Jack Kids Size Small SS T-Shirt Change the World One Friend at a Time,15368,14.76
186,Justice Girl's Size 6-7 GYMNAST Tie Dye Sparkle Tee New with Tags,186,84.04
6410,"Under Armour Little Girls' ""Girls Always Win"" Grey T-Shirt - Size 4 - NWT",6410,48.2
9391,OLD NAVY KIDS GIRLS STUDENT UNIFORM SCHOOL BLUE TOP COLLAR POLO SHIRT S 6/7 NWT,9391,36.13
12782,BN W/ Tags Old Navy Short Sleeve Girls Pique Polo Shirt 3 Button Size 6-7 Small,12782,33.59
8220,New Girl's Nike White You're Looking at it T-shirt size Large,8220,59.79
12917,Realtree Real Tree RG Top Shirt Girls Girl Size Youth L Large  NWT NEW Blue ,12917,33.59
916,"NEW John Deere Pink Logo T-Shirt Sizes 4, 5/6, 6X ",916,48.54
4394,"ASICS Youth Juniors Volleyball Set Jersey Top, Blue/White, Large",4394,140.2
657,T-Shirt Top Tee Solid Short Sleeve Crew Neck Blue Purple Youth Girls Cleo Dot,657,44.8
5049,Girls Under Armour Dolman Tee Free S&H US Seller,5049,56.01
11473,NWT - Nike - GIRLS - THE NIKE TEE - Athletic Cut - Size Extra Small,11473,56.05
12367,BNWT Disney Store Vampirina Girls Costume T-Shirt Top Size XS 4,12367,37.18
1185,NEW Abercrombie Kids Lot of 2 Girls Lace Tank Top Floral Peasant Top Size Small,1185,84.3
7256,NWT GIRLS JUSTIN BIEBER PURPLE SHORT SLEEVE T-SHIRT WITH PICTURE SIZE XL,7256,63.49
11990,"NEW LEVI'S GIRL'S ""I LOVE NY LEVI'S"" GREY HEATHER SHIRT SZ 5 (S ) 4-5 YEARS ",11990,39.01
4475,Disney Frozen Girl's I'm Olaf Pink Striped Glitter Short Sleeve T-Shirt,4475,52.13
14026,Peanuts Snoopy Girls T-Shirts White or Gray Sizes Small 4-5 or Medium 6-6X NWT,14026,36.58
14954,NWT Girls Halloween Graphic Tshirt Boo Ghost Pink M XL Cat and Jack,14954,11.02
15285,"BEAUTY & the BEAST T-Shirt Girls Juniors Youth Size S (3-5), New, Disney 2017",15285,37.18
10793,NEW Girls Rivalry Threads WISCONSIN 1848 T-Shirt Size XS 4/5 Red Glitter Zebra,10793,37.18
2906,SAVED BY THE BELL Juniors Girls Kids Short Sleeve T-Shirt RED HEATHER AUTHENTIC,2906,74.7
4465,GYMBOREE size 7 or 9 Homecoming Kitty Cotton Shirt NWT Most Valuable Princess,4465,44.84
2173,New Lularoe Frozen Disney Size 12 Gracie Anna Very Rare,2173,74.73
14115,Girls Beautees butterfly heather grey shirt with glitter all over glamor,14115,14.95
15555,"Disney Girls T-Shirt Avengers, I’m A Hero, Color White, Size M 7/8",15555,12.41
9387,NWT Peanuts snoopy Dog House singing Christmas Green shirt girls top XS M Sings,9387,41.1
9823,C9 by Champion XS 4-5 Girls Activewear Gray Shirt V-Neck,9823,26.12
4545,"Monteau's Max & Riley Girls' Lace-Detail Striped Top,Size S(7/8), MSRP $34",4545,67.22
16022,Ralph Lauren Girls Purple Multi Crowned Dragon S/S Rugby Polo Shirt,16022,65.35
5456,"NWT Gymboree Calypso Patch sleeve Ivory & pink Shirt,Top  Girl 4",5456,84.08
9056,Hurley Girls T-Shirts 4 Shirts to Choose From Sizes S 8-10 and XLarge 14-16 NWT,9056,41.81
12227,Old navy Turquoise Blue Girls  tee Shirt  Active size S 6-7 short sleeves New,12227,25.82
16042,"NWT Gap Kids girl brown t-shirt w/""beach lover"" in pink & flowers; size XS",16042,56.01
10304,"New Youth Girls Hello Kitty ""Happy B-Day"" Birthday Shirt Pink Glitter",10304,26.12
1772,"Justice Girls Top Blue Lace Short Sleeve Size 16, NWT! $24",1772,39.24
9090,NWT Gymboree Tan Short Sleeve Zebra Flower Shirt Girls S 5-6 5 6,9090,37.33
7963,NWT Nike Girls Dri-Fit Short Sleeve Running Pink Tank Top Large,7963,74.73
5683,Under Armour Girls Top Heat Gear Shirt Top Size 6  ~ BEAT THE BEST.       #117/7,5683,60.5
8271,NWT Adidas Girls Black Graphic T-Shirt Size S- 8/10,8271,48.54
6271,Old Navy Girls Gray w blue floral High Low Top w Eyelet Lace Bottom Multiple Sz,6271,40.92
4675,PEZ Juniors Girls Kids Short Sleeve T-Shirt BLACK WHO WANTS CANDY,4675,74.7
9023,Super Cute Golden Girls T-Shirt size large  ,9023,56.05
13617,NEW GIRLS HELLO KITTY WHITE SHORT SLEEVE HEART T/SHIRT SIZE S,13617,26.16
16127,NWT Gap Kids girl short sleeve lavender t-shirt w/top seam bellow the neck; M,16127,48.54
4579,Epic Threads Girls'  #Beach Goals Graphic Print T-Shirt Bright White Large NWT,4579,61.62
10940,NWT Girls Short Sleeve Dog Shirt  Size Medium,10940,14.91
12643,Girls Youth Cat Kitty T-Shirt Loveable Cute XL 14/16 NWT kitten tiny grey scarf ,12643,37.18
2939,NEW! AIR JORDAN SHORT SLEEVE TEE PURPLE GIRLS MEDIUM,2939,37.33
15431,Girls Size 4T Short Sleeve Shirt Gymboree,15431,37.33
11021,HANNA ANDERSSON Wanna Play Belt Tee Top Shirt Clay Grey White 120 6-7 NWT,11021,26.12
8656,"gap kids girl's t-shirt size  S(6-7) , L(10) , XXL(14-16)",8656,49.29
14085,Gildan youth regular fit large horse & pleasure rider  t-shirt New,14085,26.12
1756,NWT GYMBOREE 2pc lot Green Flower Top Floral ballerine long short sleeve Size 6,1756,93.04
9846,BNWT Beautiful Designer JUNIOR GAULTIER Girls Long Sleeved Striped Top Size 10,9846,298.9
355,NEW GAP GRAPHIC CAP SLEEVE TOP TEE SIZE S 6/7 M 8 L 10,355,69.13
5881,Disney Store Minnie Mouse Classic T-Shirt for Girls - Gray L(10/12) New W/Tag,5881,78.47
14049,Art Class Girls' Rib Knit T-Shirt Short Sleeve Green/Black/Cream Stripe Lg 10/12,14049,37.33
6099,Disney Princess Little Mermaid Ariel Youth Girl's T Shirt Blue Size Large  NWT ,6099,44.47
11290,NWT Nike Girl's Graphic T-Shirt Print Cotton Blue AT5665-495 Medium ,11290,22.08
719,Gymboree Cape Cod Cutie Top Size 7 Pink Lobster Shirt Girl Twins Summer New,719,48.17
2950,NEW SANRIO HELLO KITTY HOLLYWOOD METAL STUD TOP 5 6X,2950,69.13
10489,Girls 6 ELSA FROZEN Tie Tshirt nwt Queen Princess of Snow & Ice Sparkles Glitter,10489,30.49
7791,"NWT GIRLS GYMBOREE SZ 2T, 3 3T, 5 SHIRT, SKIRT, HAIR CLIPS SUNNY CITRUS LEMON",7791,85.91
1829,NEW SANRIO HELLO KITTY SEQUINED GRAPHIC PINK TOP TEE SIZE 6,1829,69.13
11690,"Cute Girl's ""Simply Styled"" Shirt Size 16 (Brand New)",11690,25.41
7904,Ralph Lauren Girls Red & White Striped T-Shirt Top - Size 6 - NWT,7904,55.27
5060,Nike Girl's - No Rest For The Best - Green Purple Graphic Tee Shirt V Neck Large,5060,48.39
12942,Girls 10-12 (L) Pink IT'S NOT EASY BEING A PRINCESS...Tiara/ Shirt-Top-NEW-Tee,12942,37.33
2780,STREET FIGHTER Juniors Girls Kids Short Sleeve T-Shirt WHITE STREETFIGHTA,2780,74.7
6690,NEW MISS ME Girls White Gray Stripe BORN TO BE QUEEN Crown Gem Top Shirt S M L,6690,36.99
10237,Ralph Lauren Girls T Shirt Jersey Tee Crew Neck Short Sleeve L(12-14) NWT,10237,55.12
2557,Gap Kids Girls x ED Blue Indigo CREATIVE French Terry Tunic Shirt NwT XS M,2557,74.55
11263,Cat & Jack Girls Black & White TopSize XS 4/5 NWT CAMISA DE NINA  C15,11263,34.56
13790,NFL Team Apparel Girls New York Giants T-Shirt Size Medium 10/12,13790,14.91
7705,Justice Girl's PARIS Patches Tee Size 14 Plus NWT,7705,50.41
5373,WIZARDS of Waverly Place Shirt Girl's 14/16 NeW Glittery Pink Selena Gomez NWT,5373,63.49
7668,Girls Justice Black white Sheer Open Front Fringe Shrug Jacket Size 16/18 - NWT,7668,41.1
9742,Girls Size 14 White ARIZONA Horse  Short Sleeve Top-New-Cute!!$16,9742,35.5
10231,French Toast Red Polo Little Girls Size 4 School Uniform New,10231,23.43
1656,VALENTINE'S DAY Love Love Love Girls T-Shirt Top Kids Youth X-SMALL XS 4/5,1656,41.07
2484,Disney Store Mickey Minnie Mouse Short Sleeve Hearts T-Shirt Tee 14 Girls,2484,74.7
10834,GYMBOREE DAISY DAYS MULTI COLOR STRIPE GEM FLOWER S.S TEE 4 5 NWT,10834,27.99
8932,True Religion Big Girl Polka Dot Print Tee Pink White Short Sleeve Shirt S 7 NWT,8932,93.31
1007,"Skin Industries Children Girls's T-Shirt ""Calm"" --Youth Size S to L, White",1007,33.59
15319,Girls Size Large (10/12) Black Old Navy Scoop Neck T-Shirt,15319,26.16
12193,Gymboree bright and beachy flamingo top Size   8  10   NWT ,12193,35.5
15293,Life is Good T-Shirt Girls Loose Guitar Rouge Pink Shirt Size Small,15293,29.48
11443,Gymboree Girls Mix N Match Flowers Summer Shirt Size Xs 4,11443,33.59
9782, Fleurish Girls Top Sz 6 X Pink Princess Tiarra Jewels Tee Shirt Back to School,9782,46.48
8358,NEW GIRLS SPIDERGIRL SPARKLE CAP SLEEVE T SHIRT BLOUSE TOP SIZE L 10/12 XL 14/16,8358,37.33
12021,My Little Pony Pals Girl Top T Shirt Tee Size 4 White Pink Purple Glitter,12021,29.71
13313,TINKERBELL TOP - SZ. S 6/7 - NEW,13313,26.16
5420,HELLO KITTY GIRLS T-SHIRT PINK & WHITE STRIPE GLITTER  SIZE 4 NWT KOHLS $16 NIB,5420,38.3
9597,"My Little Pony Rainbow Dash,Pinkie Pie & Fluttershy ""Aloha Ponies"" Tee S (4)",9597,35.31
6540,"GYMBOREE Girl ""Posh & Playful"" Collection City Print Top New Size 7 / 8 / 10",6540,47.79
3686,"NEW Under Armour Girls ""This is Girl Power"" Foil Graphic Tee Shirt Top in Black",3686,48.46
808,Twin girls Patriotic Red Silver Blue Sequins Butterfly pink shirts NWT 4 5,808,48.39
2515,"NIKE ""Better Every Day"" Big Girls Graphic Cotton T-Shirt Tee (S) Small Blue",2515,41.07
11950,Disney Cinderella  Girls Blue T-Shirt Sizes 4-5 or 7-8 or 10-12  NWT,11950,36.58
13042,NWT Girls Nike Bright Blue Ruffled Short Sleeve Logo Shirt Size Large 12/14,13042,24.25
1277,NWT Gap Kids Red Polo Shirt / Top Size XL / 12,1277,50.41
11930,Brisco Bay Active Wear American Beauty Girls Shirt size 7-8,11930,33.59
10134,NEW girls top shirt American Eagle Outfitters 1 size 7-8-9 cheap s/h,10134,26.87
7211,Indianapolis Colts - Jewel Team Name Girls Youth 2fer,7211,40.88
6699,"Girls Size 16 New Balance ""Strong Beyond Measure"" Short Sleeve Tee Nwt #10308",6699,37.37
1513,"Harley-Davidson Little Girls' Glitter Wings Swirl Tie-Dye Tee, Purple 1530731",1513,59.6
11106,BEEHAVE BIG SISTER BOUTIQUE PULL OVER KNIT TOP BLOUSE EMBROIDERED APPLIQUE NEW,11106,33.18
11996,Disney Stitch Limited Edition Collection Jumping Beans T-Shirt Size 6 New W/Tag,11996,67.26
13429,NWT NIKE Girls Swoosh Short Sleeve Shirt AH7521 Black 010 Size M L XL Athletic,13429,29.89
14188,NEW Girl Size L Stars & Sprinkles Color Me Tee & Washable Marker Set  SNEAKERS,14188,24.29
6517,DISNEY Princess ARIEL The Little Mermaid Top Shirt 6 6X  NEW NWT,6517,40.92
13068,NWT Sanrio Hello Kitty white pink black aqua SS knit shirt girls sz 5,13068,22.42
7232,Justice Girl's My UNICORN NEEDS ME Tee Size 14  NWT,7232,50.41
6418,Authentic Abercrombie Kids—Girls Lace Jersey Tee—Pink or Blue—Originally $19.95,6418,59.75
5774,Halloween Always Be Yourself Witch Orange Youth T-Shirt,5774,55.86
4010,Gymboree Girls Size 6 Green Floral Rhinestone Woven Shirt New,4010,39.2
11397,2017 NWT YOUTH GIRLS BILLABONG EPIC DAY TANK TOP $30 M goldrush lets be mermaids,11397,63.08
2018,BACK TO THE FUTURE Juniors Girls Kids Short Sleeve T-Shirt GRAY HEATHER TIME,2018,74.7
4204,NWT GYMBOREE WOODLAND WONDER FOX HEAD PRINT  SHORT SLEEVE BOW TOP  SHIRT SZ 8,4204,63.49
14041,DISNEY Little Girls Minnie & Daisy “BFF” Short Sleeve Shirt (size 4) **NWT**,14041,23.5
3693,NWT GYMBOREE CHERRY BLOSSOM PURPLE HUMMING BIRD  SHORT SLEEVE TOP TEE SHIRT SZ 6,3693,63.49
15583,Aeropostale Girls Glitter Feathers Graphic T-Shirt,15583,63.49
9603,CONVERSE ALL STAR GIRL'S SHORT SLEEVE FROZEN-LILAC T-SHIRT SZ 4 3-4 YRS,9603,49.66
15602,New Kids Girls Ralph Lauren Polo Big Pony Short SLeeve  Polo Shirt Size 6 6X,15602,89.64
2057,NEW SANRIO HELLO KITTY GLITTERY GRAPHIC TOP TEE SIZE 4 5 6,2057,69.13
9152,NWT POLO RALPH LAUREN GIRLS POLO 2010 US OLYMPIC TEAM T-SHIRT XL(16) #45,9152,93.38
7477,Janie and Jack Luxury Swan Print Top Poplin Ivory 100% Cotton sz 8,7477,74.73
1004,Marni girls grey striped cotton short sleeve tops blouse NWT size 4y,1004,328.83
8861,GAP KIDS EMBELLISHED PHOTO-REAL GRAPHIC TEE SHIRT NWT small 6-7 N5,8861,37.33
14718,# RED ROCK Top Shirt w/EMBROIDERED SEQUINED CROWN WINGS NEW NWT GIRLS XLARGE,14718,29.71
168,New OshKosh Girls Dark Pink Turtleneck Top NWT 3T 4T 5T 6 7 8 10 12 14  Shirt,168,37.37
16227,The Children's Place Big Girls' Embellished Short Cap Sleeve Top #81323 Sz XL 14,16227,44.8
7500,"LuLaRoe American Dreams Sloan Tee SIZE 8 FLAGS; Americana, 4th of July, RED BLUE",7500,56.01
13153,NEW W/ TAGS UNDER ARMOUR Youth Top Sz 4 Retails $25,13153,37.33
5576,NWT UNDER ARMOUR SHIRT WHITE BREAST CANCER FIGHT LIKE A GIRL GIRLS YOUTH SMALL,5576,63.49
405,New TCP The Children's Place All American Girl & Dog Top 4 5 6 7 8 10 12 14 NWT,405,37.37
5014,Ralph Lauren Girls L Top Blouse Shirt Lace Ruffles Short Sleeve Navy NWT,5014,73.95
15484,"NEW GIRLS DISNEY FROZEN WHITE OLAF SNOWMAN ""CHILLIN"" T-SHIRT SIZE XS (4/5)",15484,20.51
7528,Girls Trollhunters 'Be Your Own Hero' Graphic Short Sleeve T-Shirt - Ivory - S,7528,37.33
7650,DISNEY Store TEE for Girls FULI THE LION GUARD TShirt Choose Size NWT,7650,74.55
16650,Girls Kids Youth Under Armour T-Shirt NEW Short Sleeve Blue Top Size 6 V-Neck,16650,47.05
15235,Petit Bateau Classic Short Sleeve T-Shirt Fuchsia Pink Childs 2 NWT $20,15235,29.89
13311,Girls OshKosh B'Gosh Kids Shirt - Size 5,13311,23.88
2205,NEW SANRIO HELLO KITTY SPARKLY GRAPHIC TOP TEE SIZE 4 6,2205,69.13
2592,New Carter's Puppy Dog will Travel Applique Graphic Tee Top  NWT 2T 3T 4T 5T 6 7,2592,37.37
13251,NWT J Khaki Preschool Girls 6X Pink Polka Dot Embroidered Toucan Bird Cute Shirt,13251,37.25
196,DC COMICS Batman Suit Up Glitter Logo Girls T-shirt XL NEW,196,52.13
8329,"LulaRoe Floral Geometric Print Bianka Top  Size 3, Girls 10-12",8329,97.12
14807,Tri Blend Racerback Tank - PimaTee Girls' Contrast Racerback Tank Top,14807,37.18
11919,BRAND NEW Girls T-Shirt Tees Lot Short Sleeve Size M 5 6 Shopkins hatchimal Tops,11919,85.91
12804,ARIZONA JEAN CO NWT GIRLS STRIPED SHORT SLEEVE T SHIRT. ORIGINAL COST $14 COTTON,12804,26.12
3664,Gymboree Desert Dreams 4 5 6 7 8 10 Shirt U Pick Camera Wolf Chambray Pink 2014,3664,42.08
15908,Aeropostale Girls Love NY Embellished T-Shirt 838 L - Big Kids (8-20),15908,30.12
4287,NWT 5 Years Gymboree BON VOYAGE Ivory & Gray Striped Anchor Heart Polo Shirt Top,4287,47.61
5478,"Junior Girls Yellow Blouse Peter Pan Collar French Toast Uniform size 42, 44, 46",5478,41.07
2564,***New*** KIDS Kerusso Dino_mite! KDZ1596,2564,48.54
4173,Lost Gods St. Patrick's Day Four-Leaf Clover Luck Girls Graphic T Shirt,4173,70.81
14586,NEW GIRLS GRAY HELLO KITTY BOW T/SHIRT SIZE S,14586,26.16
7721,New Lularoe Gracie Kids Shirt Size 14 pink salmon blue statue of liberty soft ,7721,41.7
13005,F&F GIRLS SPLIT TAIL BELIEVE IN YOUR DREAMS GRAPHIC T SHIRT WHITE SIZE 7-8Y NWT,13005,35.83
6375,NWT Girl's Gymboree Cute on the Coast ivory short sleeve shirt ~ 4 10 FREE SHIP!,6375,43.53
2986,DURAN DURAN Juniors Girls Kids Short Sleeve T-Shirt BLACK DD'S,2986,78.43
14078,"The Children's Place Big Girls' Short Sleeve Top, White 80411, XXL(16) Avocuddle",14078,32.88
7348,Crazy 8 NWT Girls Graphic Tee Shirt Top Size 4 ( XS ) 4 PC Lot ,7348,63.34
13411,Star Wars Girls Gray T-Shirts Sizes 6-6X or 7-8 NIP,13411,36.58
9374,Girls Yellow Blouse Peter Pan Collar Short Sleeve French Toast Sizes 4 to 20,9374,29.86
1219,NWT Girl's 4T 4 Top Hershey's Daddy's Girl Snack Time,1219,56.01
14569,BUBBA GUMP NEW ORLEANS GIRLS Small T SHIRT Turquoise cotton  NWT,14569,33.59
14394,Girls Exertek black shirt.  Size S(8).  NWT,14394,17.56
9810,NWT Girls CRAZY 8 Zebra Unicorn Short Sleeve Top Size 10 / 12 NEW,9810,29.89
9105,Girl's Shirt by Paper-Tee Cut Out V- Neck Blue Velour Top Size Sm 7/8 NWT,9105,33.59
6134,"NWT! LIFE IS GOOD UNISEX S/S TEE  J&R ""HAPPY TRAILS""  (L) GREAT GIFT",6134,67.22
3757,Nike Youth T Shirt “Just Do it” Athletic Top,3757,40.24
13075,NWT Carter's Girls Size 4 Shirt T Shirt White Summer FAVORITE THINGS Cat Dog ,13075,18.65
14994,New Girls Medium Sesame Street T-Shirt Bert Ernie Elmo Cookie Monster Shirt,14994,35.35
6739,Piper Girls Graphic T-Shirt Blue Zebras Short Sleeve Crew Top Rhinestones XL New,6739,38.3
2770,GAP KIDS Orange Cat Ballet Shoes HEART My MOM Sparkle Cotton Tee NWT XL 12,2770,44.35
9284,AIR JORDAN 23 6 TIME CHAMP! SHORT SLEEVE BLUE ENERGY GIRL'S SHIRT SZ 5 (4-5YRS),9284,53.21
5660,"Case IH Youth Girl's Black T-Shirt ""Red Tractor Girl"" Slim Fit Size - M, L or XL",5660,56.98
665,Girl GYMBOREE LAVENDER STRIPE FLORAL EASTER EGG YELLOW SHIRT TOP NWT 4,665,48.39
13427,Roxy Girls Beach Babe Sc T-Shirts Sz 10 Medium Tee New Pink,13427,57.51
15547,Disney Tink Grey Womans T shirt Size Sm,15547,23.5
13621,Ralph Lauren Girls Top - Size 5 - NWT,13621,36.96
2160,Disney Store Doc Mcstuffins Short Sleeve T Shirt Girl 100% Organic Cotton Tee,2160,112.06
11223,Life is Good Star S/S girls tee shirt S 5-6,11223,29.82
11432,GIRLS XS 5 GREEN LUCK WILL FIND A WAY ST. PATRICKS S/S SHIRT NWT ~ OLD NAVY,11432,26.12
14596,"Xersion Girls Top Size Small (7/8) NWT ""Get It GIrl"" Super Cute!",14596,18.61
205,Baby Phat Big Girl's Sequin Stripe Tee Hot Pink Top Size Large 12-14 Years New,205,67.26
8768,Marvel The Avenger Logo Girls Child Tshirt size 6 6X S 7-8 M 14-16 XL New tee  ,8768,63.49
937,NWT Gymboree Girls Pink Ruffle Bow Top Size 7,937,40.62
8172,NWT Girls Red Short Sleeve Holiday Scarf Glitter Top XS S M,8172,23.24
13948,DC Shoes Boys Off Tee (L) Black ADBZ000010,13948,38.11
12831,Jesus Has Skills - Kids T-Shirt - WGN,12831,29.48
10766,Gap kids T Shirt Urban Blue San Francisco Graphic Sequin Banded Bottom Girls 6-7,10766,37.37
5784,NWT SONOMA Girl's Shirt Size 14 SO Butterfly Graphic Banded Bottom Tee Top Large,5784,48.54
4889,Ralph Lauren Girls Top T-Shirt Short Sleeve Gray Size M 8-10 NWT,4889,60.5
5448,NWT DISNEY SHIRT FAMILY VACATION MICKEY & PALS YOUTH SIZE XXS BLUE ,5448,93.38
2254,ZARA Girl Tulle Top Shirt with shiny writing Text Size 9/10,2254,56.01
9618,J. Khaki Girls White Short Sleeve Flip Flop Shirt Size L NWT - A2281,9618,33.59
3246,NWT Girls Justice Black Short Sleeve Top Size 18/20 - Being Magical is Ruff!,3246,61.66
2255,My Little Pony New Shirt Girls Size 3T Short Sleeve Black Pink Ponies,2255,56.01
1731,Gymboree PANDA ACADEMY Pink Button Bow Short Sleeve Shirt Top Tee NWT,1731,46.97
6416,Nike Girls Just Do It. Short Sleeve T-Shirt Voltage Green Sz 4T - NWT,6416,48.54
15412,Girls Danskin Now Active Tee Turqouise Size L 10-12,15412,20.89
9654,NWT UNDER ARMOUR GIRLS YXL POWER IN PINK S/S BREAST CANCER SHIRT,9654,52.28
15061,SUGAR ACADEMY MONKEY Girls Size L 100% Cotton Bobby Jack Short Sleeve,15061,29.89
12378,Harley Davidson Girl's Little Angel Layered T-Shirt,12378,74.55
8137,"Children's Place Girls Short Sleeve St. Patrick's Day Shirt, XXL, Glitter, NEW",8137,44.84
5628,MARC JACOBS Fancy Short Sleeve Ice cream Tee Shirt Big Kid 12 $53 NEW,5628,130.75
11128,NWT Girls Green Short Sleeve Cat & Jack Luck Laughter Top T-Shirt Large 10/12,11128,18.31
11653,NWT LOL Surprise! Leading Baby & Miss Baby Girls Shirt Sleeve Tee Shirt Size 5-6,11653,74.7
12233,"Transformers Girls' ""More Than Meets The Eye"" Short Sleeve Graphic T-shirt NWT",12233,37.29
14138,Disney Frozen Tshirt Girls Elsa Ana Olaf Hans Blue Nwts,14138,25.22
6403,Arizona Jean Co. Girl's Green Short Sleeve Crew Neck Top Blouse 2XL Plus 20.5,6403,76.04
7194,Girls Pug Christmas  T-shirt Novelty Deer Size large,7194,56.01
16034,Nautica Childrens Apparel Little Girls Every Day Graphic Tee- Pick SZ/Color.,16034,46.9
4404,NWT MATILDA JANE SZ 18 M Secret Fields BON VIVANT Peasant Pink Paris Top NEW,4404,93.38
14346,Ed Hardy Dedicated to The One I Love Tee (6 years) ,14346,54.93
14107,"Girl's Old Navy Solid Uniform Plus size Polo Shirt Top, XXL Pick your COLOR",14107,31.69
852,RALPH LAUREN POLO SHIRT Womens RLX Performance Golf Shirt ALL SIZES,852,96.67
1905,ACDC Juniors Girls Kids Short Sleeve T-Shirt NAVY LIVE,1905,78.43
9034,NWT Girls Blue White Blue Floral RALPH LAUREN SHIRT Size M 8 /10 Short Sleeve,9034,56.01
2664,Two Ralph Lauren Sport Girls XL Short Sleeve Shirts,2664,74.73
11774,Realtree Real Tree RG Top Shirt Girls Girl Size Youth Medium M  NWT Dog Pink  ,11774,33.59
12085,MUDD - GIRLS - TOP - BLACK TIE DYE CREWNECK - MEDIUM - RETAILS 24.00 (AC-40-80),12085,35.72
8158,"Girls Lego The Batman Movie ""Harley Quinn"" Gray Graphic Tee ~Size 5/6~ NWT",8158,13.08
10181,GIRLS XS 4 GREEN BE THE BEST VERSION OF YOURSELF SHIRT NWT THE CHILDREN'S PLACE,10181,22.38
12437,Disney Store Minnie Mouse Short Sleeve T Shirt Girl Size 5/6 Pink Love L@@K NWT,12437,44.8
4425,7 For All Mankind Girl's High-Low Hem T-Shirt Small Cream  NWT,4425,76.04
16429,Tommy Hilfiger Girls Pink T-Shirt - Size 6 - NWT,16429,37.33
6296,Nike Air Jordan Girls Mesh Jumpman Tank Top Tee T-Shirt Size XL,6296,59.75
1401,NWT Girl's Vineyard Vines Two-Tone Whale Pocket T-Shirt Size Large $29.50,1401,85.91
7725,NWT GAP KIDS GIRL'S GREY HEATHER STARS APPLIQUÉ RAGLAN TEE 100% COTTON,7725,47.05
12713,Old Navy Girls Light Green White striped Tee Shirt Short Sleeve size M 8 New tag,12713,23.8
9747,GIRLS XS 4 ORANGE SPLAH THE TALENT HAS ARRIVED SHIRT NWT ~ THE CHILDREN'S PLACE,9747,22.38
2355,Girl's Under Armour Heat Gear Loose Fit T-Shirt Small S Purple NWT,2355,56.01
4398,NIKE Girl's Shirt Lot Size 6 ,4398,85.76
882,Nike V-Neck Short Sleeves Black T Shirt Girls Size Medium,882,67.22
810,NWT Lularoe Bianka 3 Girls 14 16 Womens XXS Pink Purple Triangle Kimono Cardigan,810,74.7
8454,NWT GIRLS YOUTH UNDER ARMOUR USA HEART SHORT SLEEVE CREW NECK T SHIRT SZ 2T-L,8454,44.43
14218,"Epic Threads Boys Abe Lincoln Four Score & Seven Beats Ago T-Shirt White, 5",14218,36.62
2538,New Disney Store High School Musical Girls Tee T-Shirt Top L 10/12,2538,46.71
3877,"LOL Surprise Shirt, Glow in the Dark, Girls Heart Shirt, Size L(10/12)",3877,67.15
1707,NEW SANRIO HELLO KITTY HEART GRAPHIC TOP TEE SIZE 4 5 6,1707,69.13
2850,Lost Gods Cat Glasses Meow Girls Graphic T Shirt,2850,70.81
2631,NWT Gymboree Girls Aloha Sunshine Sweetie Brown Top Size 5,2631,39.12
9183,Roxy Kids 5T Top Shirt  Geo Fizz Poncho style top,9183,83.7
5724,NEW BY&BY GIRLS WHITE/PINK SIZE MEDIUM(10-12) LARGE(14) TANK TOP W/LACE COVER UP,5724,48.54
2994,New Holland Bright Pink Tractor Girl T-shirt Youth Size 100% Cotton  NH07-DRK--,2994,70.96
4263,JoJo Siwa XL 14-16 Shirt + Bow Necklace Eat Dance Sleep,4263,56.01
11604,Old Navy Girls Pink Tank Top Blouse Size L(10-12) 100% Cotton,11604,36.51
10948,"Under Armour Girls ""This is Girl Power"" Foil Graphic Tee Shirt Top in Black (XL)",10948,93.38
9265,Nike Kids Blue Paint Splask Speckle Shirt,9265,82.21
12603,Rockets of Awesome Girl's We Are Awesome Graphic T-Shirt AN3 White Size 8 NWT,12603,37.33
10596,THE CHILDREN PLACE GIRLS TEE 5/6 100% COTTON  RED SHORT SLEEVE BUTTERFLY,10596,22.42
3224,New Juicy Couture Pink Swizzl Stick Preppy Plaid Swing Top Girls Size 10 $88,3224,70.96
13597,Okie Dokie Girls Tee Shirt Yellow Cake with Ant Short Sleeve  Size S4 New W Tag ,13597,29.89
9911,NWT Old Navy Girls MED (8) Short Sleeve Uniform Polo Shirt BURGUNDY Green BLACK,9911,35.5
14072,NWT Gymboree Striped Neon Flower Top Size 10,14072,29.86
13811,Disney Pixar Inside Out Girl Disgust Green Glitter Short Sleeve T-Shirt Top 5 6,13811,26.12
10165,PS by Aeropostale Hot Pink Blouse V-neck (d05),10165,57.92
12083,NWT Gymboree Girls sz 4 Tea for Two - Cake Stripe Tee Short Sleeve Shirt ,12083,37.33
8419,GYMBOREE HELLO HAPPY BLUE w/ HAPPY GLITTER S/S TEE 4 5 NWT,8419,27.99
11140,NEW Girls T-Shirt Youth Size Small Mossy Oak Break Up Infinity Camouflage Top,11140,20.44
15537,686 Paul Frank Youth Graphic T-Shirt Black Medium NEW,15537,27.99
4682,NWT GUESS Girls Brown Short Sleeve Sweater(Size XL/ 16) MSRP$42.50 NEW,4682,87.4
15805,Under Armour Girls Pink & White Dry Fit Logo Top Size 5,15805,48.54
764,NEW MARMOT GIRL'S WHIMSY GRAPHIC SHORT SLEEVE TEE SHIRT WHITE MEDIUM,764,39.12
