id,title,file_id,price
16293,Umbro Gray Girls T shirts,16293,18.68
8159,NWT JUSTICE Girls 7 8 10 Game Day Short Sleeve Graphic T-Shirt,8159,28.03
2321,Hello Kitty Shirt Girl's XL Gray Glitter Graphic Logo Sanrio Shirt New ST05,2321,67.22
11019,Girls White Mossy Oak Pink CAMO T-Shirt * M or L* Short Sleeve Gildan Dry Blend,11019,37.18
9474,NEW L.O.L. SURPRISE DOLLS FANCY FRESH LOL GRAY T-SHIRT HEART GLOW IN DARK XS 4/5,9474,93.38
6779,Despicable Me Girls Tee 4-5 XS 6-6x 7-8 M 10-12 L 14-16 XL t-shirt New w Gitter,6779,63.49
6755,NWT New York Yankees Girl's Medium (10/12) Grey T-Shirt Glitter NY Baseball NYY,6755,37.37
1972,"NWT Girls Justice Size 14/16 Short Sleeve White Top ""Be Yourself""",1972,61.66
1436,NWT GIRLS WILDFOX KIDS BOW SWING TEE SIZE 14 LAST ONE!,1436,74.7
10014,Num Noms Scented Green TShirt Size XLarge 14/16 675,10014,33.59
5841,"NWT - CAT & JACK - GIRLS HALLOWEEN ""CAT"" SHIRT - White Glitter - Size 7/8",5841,44.8
12343,New York Giants Girl's Short Sleeve V-Neck T-Shirt Sz XL,12343,58.7
14548,NWT Skechers Active Girls Size 7/8 Active Tee Pink Glo Hth/Pink Sunset,14548,29.86
4740,JAMES DEAN Juniors Girls Kids Short Sleeve T-Shirt BLACK JAMES REBEL,4740,74.7
12587,"Toughskins Dusty Heather ""Floral"" Top Shirt Little Girls Medium",12587,37.33
15605,Aeropostale Girls Glitter Zebra Graphic T-Shirt,15605,63.49
1251,New With Tags Bella Bliss Pink/White Stripe Bunny Top Girl's Size 4,1251,70.59
5274,NWT Nike Big Girls Medium Blue NIKE Logo Graphic Crewneck SS T-Shirt Sz S,5274,44.84
13840,Joe Boxer Girls’ 3-Pack White Short Sleeve T-Shirt Size 4 Chest 24-25”,13840,28.74
14827,NWT~OLD NAVY GIRLS T SHIRT~YOUTH XL LIGHT BLUE & GLITTER PINK LOGO~SOFT~,14827,26.12
6033,NWT GIRL'S THE NORTH FACE LOGO GRAPHIC BLUE WANDER SHORT SLEEVE T SHIRT SZ S,6033,52.28
6437,NEW L.O.L. GLITTERATI SURPRISE LOL CRYSTAL GLITTER QUEEN B WHITE T-SHIRT S 6/6X,6437,93.38
14604,"NEW, WOMANS JUSTICE COLD-SHOULDER UNICORN MOM TEE, SIZE SMALL",14604,29.89
12821,Marvel Girls Guardians of the Galaxy Cotton T-Shirt Sz L Red White and Cute ~NWT,12821,33.59
15503,Disney FROZEN Elsa Anna Gold Glittery Plum Sz 6 Girls TEE TOP T-SHIRT $20 ~ NWT,15503,29.45
13384,GIRL'S CHAPS RALPH LAUREN CAP SLEEVE SHIRT-SIZE: L ,13384,33.26
16640,Girls Kids Youth Under Armour T-Shirt NEW Short Sleeve White Lead Top Size 5,16640,47.05
2861,NWT Justice Pink Dance Heart Wild About Music Top Shirt Size 5,2861,69.13
13782,Gymboree Homecoming Kitty Miss Mouse Girls Size 6 Most Princess Shirt Top NEW,13782,37.33
5114,Gymboree brand girl white color Top for size 5,5114,37.33
14610,SIZE MEDIUM K2 NIGHT OWL WOMEN'S T-SHIRT -- BRAND NEW!!!,14610,44.65
163,POLO RALPH LAUREN Polo Girls 1 Tee shirt DIFF COLORS,163,45.4
6790,"Monteau Girls' Hi-Low Rolled-Hem Screen-Pocket T-Shirt, White, Size M, MSRP $24",6790,44.8
12196,Gymboree Homecoming Kitty Miss Mouse Girls Size 4 Plaid Bow Top Shirt NEW,12196,37.33
10551,NEW Faded Glory Girls Lace 2Fer Tunic Top in Blue,10551,22.31
11194,NWT Girls Short Sleeve Peace Sign Shirt Size XS (4/5),11194,14.91
15637,Aeropostale Girls Painted Tiger Graphic T-Shirt 102 M - Big Kids (8-20),15637,63.49
14097,DC Shoes Boys Progro Tee (L) Kelly Green ADBZ000000,14097,47.83
12189,The Children Place Girls T-Shirt Size S/P 5/6 Pink,12189,20.55
4915,NWT GAP Girl's Short Sleeve Pleated Top Pink Large & XL Free Shipping MSRP$25,4915,48.54
10192,2016 NWT GIRLS BILLABONG STAY BY ME TANK TOP $30 M dark athletic grey graphic,10192,84.08
13156,GIRLS NEW NWT SIZE XL EXTRA LARGE 14/16 GRAY CIRCO SHORT SLEEVE SHIRT TOP BOW @@,13156,15.69
6379,UNDER ARMOUR GIRLS YOUTH SHIRT SIZE XL,6379,67.15
3016,Lost Gods Skull and Crossbones Cupcake Girls Graphic T Shirt,3016,70.81
11311,Nike Girls Swoosh Short Sleeve Shirt - 940795 - Blue 432 - Size M - NWT,11311,37.33
15982,New Blue/ Pink Short Sleeve Frozen Elsa/Anna T-Shirt Toddlers/Girls (2T- 6x) Bow,15982,55.86
13618,FADED GLORY DRESSY TOP SZ 6/6X - NEW,13618,26.16
2747,Action Girl's Short Sleeve Active T-Shirt SV3 Coral Pink Size 4 NWT,2747,38.08
9305,Nike Girl's Graphic T Shirt Nike Print Cotton Blue AT5665 495 Size L,9305,59.68
6929,NWT BABY GAP MODERN DANCE T TEE DANCER GRAPHIC TEE 4T 4 YEARS TULLE STARS ,6929,48.54
8904,Red Tractor Girl Vertical - Youth T-Shirt/Navy,8904,56.01
28,Justice Girl's Size 12 Peace & Love Shimmer Graphic Tee Tee New with Tags,28,60.5
815,Lularoe Kids Gracie shirt Americana Size 10 Red Black White Blue Stripes Stars,815,106.31
4531,DISNEY TOP SHIRT GIRLS - DORA THE EXPLORER RAINBOW ORANGE BLUE JERSEY SZ 6 6X,4531,52.28
10870,"Disney Store Girls Elena/Skylar -Elena Of Avalor- ""The magic whitin you"" T-Shirt",10870,56.05
12088,NWT Btween Girls Size 10 Salmon & Ivory Striped Short Sleeve Shirt Super Soft!,12088,22.42
5792,NWT Gymboree Girls black Shirt Tee Sz 5/6 Short Sleeve Back To School,5792,46.3
4269,BETTY BOOP Juniors Girls Kids Short Sleeve T-Shirt NATURAL HELLO FROM PARADISE,4269,74.7
3855,NWT Minnie mouse and daisy duck summer fun tee for girls,3855,48.2
1518,MEGA MAN Juniors Girls Kids Short Sleeve T-Shirt NAVY MEGAFACE,1518,74.7
11006,Justice girls Orange Round Neck tee shirt size 10 NWT,11006,14.95
11213,Girls Hello Kitty shirt HK53071 Doll  Pink DLP 4 NEW NWT^^,11213,23.5
13182,"NWT Girl's Kandy Kiss Blue,Light Blue unique design short sleeve shirt sz 4/5",13182,37.33
15127,J. Khaki Girls Size XL S/S Purple T-shirt,15127,10.28
1571,BREAKFAST CLUB Juniors Girls Kids Short Sleeve T-Shirt RED NEVERFORGET,1571,74.7
9991,"NWT ROSS Sportswear Girl Blue Hear, See, Speak No Evil Monkeys T Shirt Sz Small",9991,41.25
6012,Children's Place Girls Short Sleeve 'Love' Foil Heart Graphic Tee Size 5/6,6012,36.96
7052,NWT GYMBOREE CHERRY BABY SNOWCONE LOLLYPOP WHITE SHORT SLEEVE TOP TEE SHIRT SZ 4,7052,56.01
700,Justice Girl's 'STAY COOL' Black Short Sleeve Graphic Tee Size 20 NWT,700,50.41
879,NEW ABERCROMBIE KIDS GREEN LOGO GRAPHIC TOP TEE SIZE S 6/7 M 8 L 10,879,84.08
3742,"Brand New Girls Gray, White & Black Nike Shirt, Size M",3742,52.13
8837,Girls Disney FROZEN Shirt Size Medium 7-8 NEW!  Musical Singing,8837,37.37
14160,DC Shoes Boys Fazeo Tee (XL) Royal Blue ADBZ000003,14160,38.11
6695,Justice Girl's EIFFEL TOWER GRAPHIC Tee Size 14  NWT,6695,50.41
5491,"NIKE Girl's ""NOTHING BUT AWESOME"" Graphic T-Shirt ** BLACK/GREEN - XL ** NWT",5491,62.59
6670,Girls Matilda Jane Wish You Were Here My Route Tunic size 14 NWT S/O,6670,220.28
8706,DOCKERS Girls Short Sleeve 4 Button Schoolwear Shirt with Lace Detail- BLUE - 16,8706,29.86
10239,NEW GIRLS TODDLER PINK SHORT SLEEVE HOOTERS FLOWER SURF T-SHIRT CHICAGO 2T 4T 6T,10239,30.01
232, New Under Armour Youth Girls Black Short Sleeve Graphic T-Shirt Top  Medium,232,52.28
6423,New Girl's Nike White You're Looking at it T-shirt size Medium,6423,59.79
16055,Calvin Klein Boys S/S Medium Blue Woven Shirt Size 5 $37,16055,37.33
61,Worlds Greatest SISTER Birthday Gift Girls Youth Kids and Adult Tee T Shirt ,61,48.54
6266,Under Armour NWT Girls Black Short Sleeve Fitted Heat Gear Shirt Size Youth Medi,6266,56.05
4707,"Nike Dry Girl's Tee, Volt  (Yellow/Jade),  Sizes 6 & 6X",4707,65.35
5045,Sz 10/12 Lot of 3 French Toast School Uniform Shirt Navy Blue White Layered Look,5045,156.94
7767,Gymboree FLORAL REEF Bike Surfboard Pink Shirt Top* Sz 5 *NWT,7767,48.54
10270,NWT I'm A Little Bit Spacey Juniors Small Galaxy t-shirt Black Graphic Tee CUTE,10270,33.07
6871,"Monteau Girls' V-neck T-Shirt, Light Green, Size M, MSRP $24",6871,41.07
443,Under Armour Girls' Graphic OR Big Logo Short Sleeve Tech Shirt MSRP $19.99-$25,443,67.26
2563,Unicorn Birthday Shirt Cute Party Outfit Gift Women Girls,2563,48.54
6998,NEW Hello Kitty Girls Doll Pink Tiered Ruffle Top / Shirt Size 2T/4/5/6-Orig $26,6998,41.25
3723,Red Hot Chili Peppers Xerox Band T-Shirt Rock n Roll Juniors Size Tee 91453614,3723,93.23
1500,Guess Jeans T-Shirt Pink Rose Sparkle Metallic Ruffle Sleeves Girls 6X [a0510],1500,44.65
8248,NEW THE  NIKE TEE YOUTH GIRL'S GREY PINK LOGO T-SHIRT SZ L,8248,49.66
15787,Star Ride Girls Turquoise Top W/Necklace Size 4 5/6 $20,15787,48.54
8207,2017 NWT YOUTH GIRLS BILLABONG LOCAL GIRL TOP $35 M gold rush football tee,8207,98.09
2938,NWT Girls Short Sleeve Peace Love & Ponies Shirt Size L 10/12 Horse Pony Pink,2938,56.01
7389,Justice Girls Cute top shirt  Size 12. New with tag,7389,93.38
410,FOR GOD'S GLORY - Girls' Christian T-shirt***,410,55.86
15440,"NWT Jumping Beans Size 4 girls short sleeve top with lace, hot pink",15440,16.82
16,Girl's Moana Block Letter Turquoise T-Shirt,16,67.19
14020,PS from Aeropostale Girls Shirts Pink 3 To Choose Size 7 XS   NWT,14020,36.58
10791,"Nike Girls TShirts Its All Tied Up Black  Gray  Pink  Size 5-6, 8, 10-12, 14 NWT",10791,44.43
15192,ELLI CAMPAGNOLO White Polka Dot Short Sleeved Top Girls Size 14 NWT,15192,11.62
7969,NWT Girls Gray Short Sleeve Grayson Social Pinch Proof Top Medium 7/8,7969,28.74
7592,NWT Girls Sz 12 14 16 Mudd Top Positive Message Teal Believe S/S Velvet Swing T!,7592,48.54
1412,GYMBOREE Burst of Spring Size 5 or 6 Top Shirt New Stripe Tee Girls Twins,1412,40.69
5493,NWT Crazy 8 TROPICAL POP White Glitter Sequins Fun in the Sun T-Shirt Top Shirt,5493,47.61
7446,Old Navy Michigan Wolverines Shirt Girls Size L LG Top T Shirt New Stretch 223,7446,33.63
6889,Crazy 8 NWT Girls Graphic Tee Shirt Top & Skirt Size 7/8 ( M ),6889,48.39
9446,NWT Hello Kitty T Shirt Top White Pink Hearts Rainbow Glittery Short Sleeved 4,9446,37.33
3062,Lost Gods Halloween Fashion Forward Ghosts Girls Graphic T Shirt,3062,70.81
11963,"Beautees Girls Black Top ""Dreams are Magical"" Size XL",11963,30.23
14808,Girls Skirt and Top Size 8 - NEW ,14808,37.33
6305,"NWT GIRLS Gap ""Ooo La La"" Poodle NOVELTY WHITE T-SHIRT SIZE XL",6305,74.55
4906,NWT FILIA & FILIUS Girl's size 8 BOUTIQUE KLARA Dark Gray Pleated Top Shirt 7/8,4906,74.55
5966,NWT GIRLS UNDER ARMOUR YOUTH ATHLETICS SOCCER SHIRT  SIZE:LARGE COLOR:NAVY  ,5966,112.06
10157,"Old Navy Relaxed Shadow-Stripe Tee For Girls, Medium (8), Large (10-12) ",10157,33.59
12018,NWT Old Navy Active Girls Graphic Tee T-shirt Be You Be True size S (6 - 7),12018,37.33
15332,DISNEY STORE Pink Fuchsia Princess TShirt Girls Sz L (10-12) Cotton Short Sleeve,15332,33.63
10808,MINECRAFT Girl's T-shirt SZ: XS (4-5) NWT,10808,28.03
4080,Girl Top Cap Sleeve Black Plain Shirt Size 7 P.S From Aeropostale,4080,78.47
15625,evy of California Girls Hello Kitty Gold Stripe Embellished T-Shirt,15625,38.86
16677,Girls Kids Youth Under Armour T-Shirt NEW Short Sleeve Blue Top Size 6X V-Neck,16677,47.05
6559,"Brand New- DC Comics Girls ""I Love Batman"" Shirt (size Small)",6559,41.07
12251,Disney  Frozen Strong Bond Strong Heart  Girls T-Shirt  Size 5 or 6   NWT Pink ,12251,33.97
15804,adidas Kids Baby Girls Performance Melange Top (Toddler/Little Kids),15804,84.04
6223,Augusta Sportswear Girls's Short Sleeve Full Button Baseball Jersey Shirt. 1666,6223,61.62
934,NEW* 7th BIRTHDAY 7 Years Girls Graphic Shirt 7-8 Medium Gift! White Nice! SS,934,63.11
11481,Nike Girls JDI Short Sleeve Shirt - 921220 - White 100 - Size L - NWT,11481,37.33
5584,NWT Girls Malibu Sugar Black White Trim Short Sleeve T-Shirt Top Size Small 8,5584,100.85
12796,NWT Milk and Hunny Girls Heart Bow Tee Top Size 4 $42,12796,48.54
16563,"NWT Cat & Jack Hanukkah Blue Gold Menorah ""Let it Shine Shirt Girl Size M (7/8) ",16563,17.15
7383,NWT Gymboree Girls Sz 12 Pool Party short sleeve Top,7383,44.8
15060,NWT Justice Girls Size 5 Blue WHite Stripe Basic Shirt Tshirt,15060,18.5
10622,Justice choose happiness graphic tee Girls Size 5 7 8 10 NWT Free Shipping!!,10622,33.44
11619,AQUA AUTH Light Green Mint KIDS GIRL'S Top Short Sleeve Polyester Shirt Size S,11619,38.94
11451,Miss Majesty Size M(10/12) S/S   ~2 Fun looks in one shirt!!,11451,45.36
12167,GAP Kids Girls Ivory Lace-trim Tank Top Tee XS 4 5 NWT,12167,26.87
15799,Under Armour Girls Summer Lime Dream Crazy Big Dry Fit Top Size 3T 6X,15799,48.54
417,Gymboree Homecoming Kitty  White Top with Plaid Bow NWT Girls Size 6,417,59.79
5920,Lazy One Toddler Tee Shirt  Polka Dots Pink Green White Moose,5920,55.86
14488,Disney Princess Licensed Belle Short Sleeve Tee- Girls Size M,14488,18.16
15390,NEW NWT Girls Size XS 4/5 Enjoy The Little Things  S/s Fitted T-shirt Present,15390,14.91
2310,New LuLaRoe Disney Gracie 12 Incredibles Elastigirl Violet,2310,149.43
14693,Live And Tell LAT Women's Black OUI MON CHER t-shirt Size Girls XL   g10,14693,26.12
11419,"GIRLS BACK TO SCHOOL TEE SHIRT , TOTAL GIRL SIZE 5 SPARKLY & FUN! SEQUINS",11419,37.33
11114,CHILDREN'S BIG SISTER SHIRT SIZE 6 8 CHILDREN'S HANDWRITING SIMPLE DESIGN,11114,20.89
9288,NEW Girls Top shadow Silver Striped Girls short Sleeve Blue Top Size M,9288,38.67
2546,JAMES DEAN Juniors Girls Kids Short Sleeve T-Shirt NATURAL DEAN,2546,74.7
5999,GIRLS UNDER ARMOUR SHIRT T-SHIRT XS NEW NWT,5999,48.54
15462,"NWT GIRLS ""GOT CANDY"" SHIRT YOUTH LARGE 14/16~PINK EASTER EGG CHEAP!",15462,18.65
5880,New Nike Big Girls Tee Shirt Just Do It Short Sleeves Dri Fit Cotton White,5880,46.71
9921,NWT GAP KIDS GIRLS TEE SHIRT T 4-5 YEARS 4 5 GAP GIRL OFF WHITE RHINESTONE HEART,9921,41.07
12977,NWT NIKE FIT DRY YOUTH GIRLS ATHLETIC SHIRT SIZE XS PINK,12977,37.33
12722,DISNEY MINNIE MOUSE TEE SHIRT,12722,37.37
394,Reindeer Dancer  - Youth Girl Short Sleeve Curved Hem Tee,394,74.7
16280,"The Children's Place Girls' Toddler Sassy Short Sleeve Graphic Tee, Sample/dye",16280,27.8
199,New OshKosh Girl Pineapple Flip Sequin Top NWT 4 5  Girls Shirt Summer Gray,199,52.31
14200,O'Neill Girls Wild Anchor Medium Short Sleeve  Shirt,14200,57.55
1967,NWT Hello Kitty T Shirt Top Short Sleeved Pink Cupcakes hearts Glitter  4 5,1967,44.8
5951,Val Max Italy girls white top short sleeves size 6y NWT,5951,164.41
2728,POPEYE The Sailorman short sleeve polo golf shirt size juniors 13-14 NWT NEW,2728,46.71
12318,Polo By Ralph Lauren Shirt-Green/Violet  Pony-S Sleeve-Size 6X-Ruffled-**,12318,33.59
8090,Girls Youth Nike Blue Workout Athletic T-Shirt Top Size Small,8090,59.79
5941,NWT COLUMBIA Girls Junior Shirt Top Short Sleeve Light Purple Size L (14-16),5941,89.64
14164,Girls Kids Youth NIKE T-Shirt NEW Short Sleeves Top Black SizeLarge,14164,37.33
6832,New Zara Girls light blue T Shirt 9-10,6832,56.01
2724,~NWT Girls UNDER ARMOUR Gray Purple Short Sleeve Shirt Small Loose Fit,2724,48.58
10620,NEW Girls Graphic T-Shirt XS 4 - 5 Pink Happy Pretty Glitter Short Sleeve Top,10620,20.89
15773,Ralph Lauren Girls Mesh/Elastane Polo Shirt,15773,74.7
662,New Gap Kids Bright Pink Drinking Dog Top Tee Shirt Size Small  6-7 Year NWT,662,41.1
7329,LOT OF (2) NWT GIRLS Disney SPARKLY Minnie Mouse S/S T-SHIRTS  SIZE XL,7329,123.12
11102,ARIZONA GIRLS PRESCHOOL LACE SLEEVE SHORT SLEEVE SHIRTS MULTIPLE COLORS NEW WT,11102,31.76
5702,Mossy Oak Shirt Girls Medium Camo NWT YM Short Sleeve Infinity Breakup Hunting,5702,47.05
1310,Nike active short sleeve t shirt 6X L 6-7 yrs youth girls 36B961 001 White NWT*^,1310,61.62
10930,Disney Girls New with tags Frozen Anna Tee Shirt Size 6,10930,37.18
3726,New Matilda Jane Make Believe Puppet Show Top Size 4 NWT Back To School,3726,134.33
10050,High School Musical Troy shirt girls size 7/8 nwt,10050,18.8
3656,Mini Boden Girl's Heart Polka Dot Graphic T-Shirt AN3 Pink Size 4-5Y NWT,3656,67.22
12788,"Epic Threads Girls' Anchor T-Shirt, Bright White, Size XL",12788,37.33
7371,Girl's Kid's  SNOOPY Peanuts  AMERICA Patriotic White Sparkle T-shirt Tee S M ,7371,37.37
6884,Nike Girls Logo T Shirt NWT Short Sleeve Size M Pink or Purple Style 748202,6884,52.28
4991,"NWT! CLASSIC LIFE IS GOOD GIRLS S/S TEE ""BUTTERFLY "" (M- 10)...GREAT GIFT",4991,63.49
11532,New Lularoe Gracie Kids Shirt Size 4 maroon teal yellow floral flowers beautiful,11532,41.7
9435,"NWT Girl's Disney Minnie Mouse Red, Blue Bow Ruffled sleeved Tee shirt Sz 6X",9435,56.01
12806,Girls Cotton Candy & Violet Bloom Color Crew Neck T-Shirts 2 Pack Set M(7-8),12806,26.12
7981,Disney Store Tee T-Shirt for Girls Moana Ringer T-Shirt Orange 10/12,7981,67.22
124,Youth Girls Jack Skellington T-Shirt - Short Sleeve Black Purple,124,56.01
11599,SPEECHLESS - GIRLS - TOP - BEIGE MULTI - SIZE MEDIUM     (AC-27-467),11599,29.74
11137,NWT Gymboree Girl Size XS 4 Pink Berry Flamingo Bird Shirt SUNNY ADVENTURES NEW,11137,29.86
13167,DC Shoes Boys Basket Tee (M) Black Y7620390,13167,38.11
6187,RELIGION Girl's Red Love & Peace Printed Shirt B510LOT07 NEW,6187,40.32
14639,NWT Sophie & Sam girls 10 white Peter Pan collar short sleeve shirt NWT,14639,25.78
15861,Under Armour Girls' Tee Studio T-Shirt Pocket Printed Blue SZ Youth Small NWT,15861,44.84
1259,New Victoria Beckham For Target Girls Black Bunnies Collared Top SZ L,1259,149.43
10876,NWT Gymboree Girls ISLAND CRUISE Neon Chevron Stripe Shirt Top Size 4,10876,37.33
2607,Nike Little Girls Logo Sparkle T-Shirt Top White/Pink Size 5,2607,74.32
9080,Gymboree Girls' Pink Glitterologist Tee NWT GYM25,9080,74.7
14189,NWT BTWEEN GIRL'S COTTON BLEND SHORT SLEEVE GRAY TOP WHITE FLOWERS SIZE 10 NEW,14189,18.65
736,I Love NY New York Kids Short Sleeve Screen Print Heart T-Shirt Gray,736,83.74
13165,"Twirl Girls Size 7/8 I Came, I Saw, I Made it Sparkle T-Shirt SS Tropical NWT",13165,26.04
13463,NWT Gymboree Pretty in Plum  Pink Shirt Top Girls  6,13463,91.55
14838,Art Class Girls Large Short Sleeve Convertible Knit Top Pink Seek New Adventures,14838,25.97
1113,Gymboree Butterfly Blossoms Butterfly Top Girl Size 5 NWT,1113,56.01
8417,Monster High Lagoona Draculaura Cleo Clawdeen Frankie Top Tee Shirt Rainbow colo,8417,56.05
3493,"LOL Surprise Dolls Glow in the Dark, BLACK Heart Girl's T Shirt, Size  XS S L XL",3493,56.01
2478,My Michelle Girls' Big Short Sleeve Knit Top with Crossover Back and Lace Hem...,2478,107.92
15857,Under Armour Girls Pink & White Beyond The Stars Dry Fit Top Size 5,15857,48.54
7480,T-Shirt Top Tee Graphic Print Short Sleeve Crew Neck White Youth Girls Cleo Dot,7480,37.33
12420,Girls Belle Du Jour Aztec Printed T Shirt Tee Size Large,12420,33.63
6122,"Girls New Crewcuts Blue ‘Home Around The World’ T-Shirt, 10",6122,82.17
12283,Gymboree Ice Cream Sweetie Basic Pink Top Shirt Girls Size 5 NWT ,12283,37.33
16300,Kid's Tee Pokemon T-Shirt - Blue - Size XL,16300,35.09
5742,Monster High Shirt Girl's Small Gray Be Yourself Be Unique Shirt New ST122,5742,67.22
10581,NWT J. KHAKI GIRLS SHIRT SIZE 5 short sleeve top with horse MSRP $22.00,10581,37.33
14619,"NWT Girls Old Navy pink multi color short sleeve t-shirt XL 14 ""Love"" Tee top",14619,14.87
13867,DC Shoes Boys Oh Eight Tee (S) Black Y7620363,13867,38.11
14294,Twirl Size 10 THINK HAPPY BE HAPPY with Flowers Short Sleeve T-shirt Purple NWT,14294,26.04
12314,NWT Disney Store High School Musical white short sleeve shirt tee   XS - 6 ,12314,29.86
9360,Girls Juniors Red Polo Shirt Short Sleeve Red Oak 100% Cotton Size M ,9360,48.54
15796,Dream Star Girls Yellow Tunic W/Sequin Detail Size 5 $24,15796,48.54
7823,NWT GAP KIDS GIRLS PINK T SHIRT GIRLS MEDIUM 8 PINK TEE BASIC TOP T SHIRT PUFF S,7823,44.84
11168,NEW White Sierra Girls Sunny Long Sleeve Tee T-Shirt UPF30 Sun Polyester Knit,11168,37.18
1989,NWT Nike Girls I'm Already Great Cotton tee Shirt Black AA4799-010 D52,1989,50.71
218,Suicide Squad Harley Quinn Daddy's Little Monster Sublimation Junior T Shirt,218,108.18
1644,Girls Dockers Uniform White Button Down Short Sleeved Shirt Size 5 - 6X,1644,37.37
184,Twin girls SPRINKLE ICE CREAM CONE lavender tops shirts NWT 5,184,44.65
16252,NWT Gap Kids girl girl heather gray t-shirt w/store front graphics; sizi XL,16252,48.54
11821,NEW Girls Graphic T-Shirt Small 6 - 6X White Star Wars Glitter Top Disney Movie,11821,34.3
12210,GIRL'S SHORT SLEEVE STRIPED PULLOVER TOP BY6 WONDER NATION / SIZE L,12210,18.68
2110,Girls 5 Seconds of Summer Tee T Shirt Top Size Small 8 Black Music Group,2110,44.65
13773,NWT Disney Minnie Mouse T-Shirt Ruffle Sleeve 6X,13773,33.59
11855,DR SUESS Girl's Cat In The Hat For President Short Sleeve T Shirt GRAY Medium,11855,18.65
7819,Peter Pan Collar Girl Blouses Short Sleeve Navy Piping Uniform School Shirt New,7819,22.42
3707,TWISTED SISTER Juniors Girls Kids Short Sleeve T-Shirt BLACK VINTAGE TS LOGO,3707,78.43
8659,NWT Hello Kitty T Shirt Top Black Peace OUT Short Sleeved Colorful glittery 7/8,8659,37.33
1057,NWT Gymboree 5 5T White Tropi Cutie Seahorse Little Splasher Top Tee,1057,59.79
8123,Nike Fly And Mighty Cotton Pink Girls T-Shirt Size L,8123,56.01
1845,New NEXT UK Pink Sunny You Make Me Smile Tee Top Shirt Size 6 Year or 116 CM NWT,1845,44.84
4754,NWT Hello Smurf Shine girls Smurfette short sleeve shirt size XS (4/5) ,4754,43.42
1271,Nike Pink T-Shirt Girls Size Extra Large  XL  NWT,1271,48.46
15242,Next Level Girls Cover Stitched Baby Rib Knit Collar Princess T-Shirt. 3710,15242,19.02
9325,AIR JORDAN GIRL'S SLEEVELESS JUMPMAN BLACK CROP TOP.  SZ 4 XS (3-4 YRS) ,9325,53.21
530,~NEW 8th BIRTHDAY 8 Years Girls Happy PRINCESS Shirts 7-8 10-12 14 16 Gift PARTY,530,56.01
18,Ralph Lauren Girls T-Shirt Short Sleeve Crew Neck Stretch Shirt Pony Logo S L Xl,18,74.7
6712,Old Navy High-Low Short Sleeve Heather Blue Burnout Shirt Top Girls XL 14,6712,29.86
10533,Girls youth Hello Kitty shirt HK50313 Bananna Yellow 4 NWT^^,10533,24.62
13456,DC Shoes Boys Spray Star Tee (M) Charcoal ADBZ000006,13456,38.11
16411,NWT Gymboree Outlet Denim Blouse With Yellow Flower Size 6,16411,26.12
7882,Hanes 3 Pack Girls White Tank Size :L,7882,27.99
7805,Children's Place Girls Cardigan Shrug Size 5 6 Tutu Pink Cropped Short Sleeve,7805,58.89
4861,PUMA TOP TEE SHIRT GIRLS DREAM PRACTICE SZ 5 PINK SHINE NEW,4861,56.01
1581,NEW* 8th BIRTHDAY 8 Years Girls Graphic Shirt 7-8 Medium Gift Purple Princess SS,1581,56.01
8788,"Nike Girls T-Shirt Green  Size-4 ,6 or  6X (Better Than Fast ) NWT",8788,41.81
12080,"MUDD Girls Size 10 ""Only Did It For Likes"" Short Sleeve T-Shirt Raw Edge Pink",12080,17.75
11100,Girls 4 ELSA FROZEN Tie Tshirt nwt Queen Princess of Snow & Ice Sparkles Glitter,11100,29.89
6365,"Girls Size Small New Balance ""Strong Beyond Measure"" Short Sleeve Tee Nwt #10254",6365,37.37
13495,NWT Gymboree Girl XS 4 Navy Short Sleeve Shirt Pink Flower BRIGHT DAYS AHEAD NEW,13495,29.86
12940,New Joules JNR LENA Girls Short Sleeve Polo,12940,104.63
11155,NEW Girls Pink Short Sleeve T-Shirt Size 4 Top Fringe Glitter Love Colored Heart,11155,17.9
5041,Under Armour Boys SS Green Hustle Sold Separately Loose Fit Shirt XL NWT,5041,52.28
7105,NWT Disney LuLaRoe Gracie Shirt Oogie Boogie Print Size 8 Short Sleeve Youth,7105,127.05
10953,Hanes Girls Heathered Shirt Short Sleeve Tee Sport Tech Performance Cool DRI,10953,37.82
6997,Guess Kids Girls Top Laced Flutter Sleeve Designer Sz 4 Small Blue A1,6997,112.06
1161,Kung Fu Panda Movie Po And Friends All Over Print Sublimation Junior T Shirt,1161,119.39
1502,New Under Armour Heat Gear Youth Girls Pink Graphic T-Shirt Top Size: Large,1502,63.49
11089,NWT Girls Green Short Sleeve Frozen Elsa Top Large 10/12,11089,23.24
14832,NEW CHEROKEE Hot Pink Shirt Sleeve Shirt With Black Bow Tie Print Girl's Size 4T,14832,18.65
16588,NEW w/Tag-Girl's Mudd Blue soccer t-shirt Size L 14,16588,26.16
1862,~NEW~ 7th BIRTHDAY 7 Years Girls Graphic Shirt 10-12 Large Gift! Blue Party SS,1862,56.01
3357,"Disney Store Ariel Sebastian The Little Mermaid Short Sleeve T-Shirt 5/6, 10/12 ",3357,70.96
956,"Washington Redskins NFL Youth Girls Short Sleeve Tri-Blend Tee Shirt, Grey",956,48.54
11989,"LEVI'S GIRL'S ""LEVI'S SAN FRANCISCO CITY"" TEAL SHIRT SZ 6 (M ) 5-6 YRS",11989,39.01
8865,NWT Polo Ralph Lauren GIRLS POLO T-SHIRT GREEN #67,8865,89.64
7638,New  Kid's Girl's  PAUL FRANK T-SHIRT  Tee S M L XL  Band Heart ,7638,37.37
16205,New Girls' The Children's Place Cap-Sleeve Black T Shirt Sz S (5/6) NWT,16205,48.39
3560,Crazy 8 Girls Tee Shirt Sz S 5 6 Ruched Short Sleeve Cute Pink 100% Cotton New,3560,48.13
8970,My Little Pony Pinkie Pie Awesomeness Licensed Size 5/6 7/8 10/12 14/16,8970,41.07
6040,NEW -10x WHOLESALE BRUCE SPRINGSTEEN 3 SHOW CONCERT BAND T-SHIRT GIRLS 2XL / XXL,6040,81.42
12757,NWT Girls Green Short Sleeve Cat & Jack Luck Laughter Top T-Shirt Small 6/7,12757,18.31
16296,Disney Girls Big Girls Jungle Book Short Sleeve T-shirt Grey Medium 8-10,16296,26.12
1153,Girls Under Armour Trifold Logo Tee Size 6 Purple,1153,63.52
9852,GYMBOREE PARISIAN AFTERNOON NAVY BON VOYAGE TANK TOP 4 5 6 8 NWT,9852,27.99
9264,ROXY YOUTH GIRL SUNSET TEE SUNRISE PINK SHORT SLEEVE SHIRT SZ XXL (16) ,9264,63.49
12197,"NWT Nike ""Been There Won That"" Drifit T-shirt Sz 6 Bold Berry Girls",12197,32.85
9441,AIR JORDAN YOUTH GIRL'S JUMPMAN SHORT SLEEVE V-NECK SHIRT SZ L (12-13 YRS) ,9441,56.76
1478,Gymboree EVERYDAY FAVORITES Girls Navy Blue Bow Pocket Basic Tee Shirt Top NWT 6,1478,46.97
822,New Under Armour Girls Solid Big Logo Short Sleeve Shirt Size Small,822,54.18
4511,"Nike Girl's ""Watch & Learn"" Grey Heather Short Sleeve T-Shirt",4511,67.07
16425,Girl's Under Armour Black Athletic Shirt Size XS-NWT,16425,59.75
11615,nwt French Toast white nautical look short sleeve button blouse girl 5 6,11615,47.61
12998,Gymboree Girls White Ostrich Free To Be Me! Tunic Shirt Top (NWT),12998,37.33
14939,Ideology Girl's Bright White Graphic-Print T-Shirt Sz 5 ,14939,29.37
14565,Rocawear toddlers New White Button Down Blouse Sz 4T (#e8),14565,14.95
351,~NEW~ 5th BIRTHDAY 5 Years Girls Happy PRINCESS Shirts 5-6 Small Gift! CUTE,351,56.01
9451,NWT JUSTICE Girls 7 12 Dog Studded Swingy Tee,9451,37.33
16669,"NWT Under Armour Girls ""Heat Gear"" White Top With Volleyball And Soccer Balls...",16669,41.07
14860,Girls Miss Understood Short Sleeved Shirt Size Small Light New W Tags Turquoise,14860,30.98
7771,Carhartt Force Girls Love To Hunt Tank Top Shirt Pink Size XS 7,7771,52.31
14073,Basic Editions Girls Size XL Short Sleeve Shirt Cable Knit Print Layer Me,14073,37.33
15490,Squinkies Girls Shirt Size 6 Yellow Short Sleeve T-Shirt Star Hearts NWT,15490,8.93
15928,Bienzoe Girl's Antimicrobial Breathable Quick Dry Short Sleeve T-Shirt 3PCS Pack,15928,114.27
