id,title,file_id,price
14043,NEW Girls Star Wars FORCE FOR CHANGE Women's Black T-Shirt Unicef SIZE XS,14043,18.68
4814,NWT Justice Orange Trick or Treat Boo Top Glow in the Dark Size 5,4814,56.05
505,Four Main Food Groups - Youth Girl Short Sleeve Curved Hem Tee,505,74.7
5851,"NWT!! LIFE IS GOOD GIRLS ""GOOG KIDS"" S/S  TEE ""JACKIE ICE CREAM""  (L) GREAT GIFT",5851,74.7
16499,NEW GIRLS OSHKOSH PINK SHORT SLEEVE T/SHIRT WITH HEART SIZE 4,16499,18.68
15754,Under Armour Girls Periwinkle Dry Fit Logo Top Size 3T 4T 4 5 6X,15754,48.54
13554,NWT Forever 21 Cream Colored Knit Top Size Girl's L,13554,33.59
7506,Children's Place  Short Sleeve 'Girls Can Do It All!' Graphic Tee Size 14,7506,36.96
6904,Patagonia Girls/Kids Femme Fitz Roy T-Shirt 62218 Cerise Size Small,6904,74.66
7999,Mossy Oak Break-up Infinity Youth Girls' Camo Short Sleeve Shirts: S-XL,7999,29.86
1546,JAWS Juniors Girls Kids Short Sleeve T-Shirt NATURAL FADE,1546,74.7
1206,~NEW~ BIRTHDAY Girls Boys Shirts 1st 2nd 3rd 4th 5th 6th 7th 8th Years Gift!,1206,48.54
13457,DC Shoes Boys Gridify Tee (L) Red Y7620442,13457,38.11
4351,AUTH $120 Burberry Children Girl's Green Polo Shirt,4351,313.88
8603,DISCREET Striped Shirt/Top with Pink Accent Belt~Girls Size XL~Black/White~NWT,8603,48.54
2399,Lost Gods Two Moon Unicorn Girls Graphic T Shirt,2399,70.81
1816,"Girls Old Navy Shirt W/Gold Lettering ""Old Navy"" & Flower-Dk Gray-Sz S[6-7] (A3)",1816,40.92
10265,EUC Girls CHEROKEE Navy Blue Short Bell Sleeve School Uniform Solid Polo Shirt M,10265,22.42
10206,AQUA NWT AUTH Emerald KIDS GIRL'S Short Sleeve Top Size L FAST SHIPPING,10206,38.94
9071,"Epic Threads Girls' Dream Believe and Repeat T-Shirt,Black, Size M , MSRP $18",9071,37.33
6330,Girls Rose Flame Bike Oval Youth T-Shirt,6330,55.86
7317,Classroom Uniforms Girls New Button Front Placket Peter Pan Blouse. 57322,7317,39.57
14884,NEW Disney Frozen Princess Elsa Anna Girls Shirt Yrs2-10 SHIPS FAST FROM US,14884,37.33
16521,New LuLaRoe Kids' Gracie Tunic T - Disney Frozen Elsa Flowers Purple - Size 6,16521,134.52
13258,Anna Elsa Frozen Disney World Youth tee shirt Olaf Kristoff Moana Maui Hans,13258,18.65
334,New Under Armour Youth Girls All Season Dark Gray Long Sleeve T-Shirt Medium,334,93.38
11464,NIKE GIRL “ LET ME DO MY THING” T-SHIRT size L WHITE,11464,37.37
8542,GJK632W Wrangler Girls White Crew Neck Tee COWGIRLS ROCK NEW,8542,56.01
4985,Cat & Jack Girls Short Ruffle Sleeve TShirt W/Pocket Charcoal Select Size (3771),4985,33.59
9043,Girls NIKE DRI-FIT Athletic Shirt Size YOUTH Large I'm Already Great,9043,56.05
3425,ACDC Juniors Girls Kids Short Sleeve T-Shirt NAVY HEATHER JAILBREAK,3425,78.43
4009,"Girl Scouts ""Think Green"" Girls 100% Cotton Cap Sleeve Tee Shirt - Size M ",4009,67.22
4532,"~New~LUCKY BRAND Girls' Short Sleeve Graphic Tee ""Dont Worry Be Lucky"" Size XL",4532,74.7
3496,NEW GAP SWIM TEAM GRAPHIC TOP TEE SIZE XS 4/5 M 8,3496,61.66
15078,MODERN LUX- GIRLS SQUAD TEE SIZE XS 4/5,15078,22.38
6094,Gymboree Mermaid Cove Sequin Seastar MAKE WAVES White Shirt 4 Kid Girls NWT,6094,40.92
15533,One step up pink button down shirt girls' size 10-12 (31888),15533,7.44
13287,$25 GapKids XL 12 CORAL Angel Flutter Top Pleated Full Cotton Blend Gap Kids,13287,33.59
5544,Jacadi Paris Blue Cotton Short Sleeve Girls Top Shirt T-Shirt size:8 A /128 cm,5544,112.06
3972,Gymboree GLAMOUR SAFARI Pink Yellow Multi Color Flower Stripe Tee Top NWT 5,3972,46.97
5196,New Uniqlo For Laduree Pink Girls Dessert T-shirt SZ 5/6,5196,48.54
15964,Harry Potter NEW Blue Girls Large L Space-Dye Solemnly Swear Tee T-Shirt $30 131,15964,48.46
2129,Disney Pixar Inside Out Shirts M 7/8 Pink Blue Yellow Stripes Joy Sadness Tops,2129,59.75
14482,NEW PHINEAS AND FERB WHITE SHIRT DISNEY STORE SIZE  S 5/6,14482,26.12
5362,ADIDAS ORIGINAL GRAPHIC Shift T - SHIRT Girls  GRADE SCHOOL Tee Size XS,5362,53.77
2224,Gymboree HELLO HAPPY Girls Coral Sequin Stripe Heart Tee Shirt Top NWT 4,2224,46.97
4246,Children's Place Girls Short Sleeve Glitter 'Beautiful' Butterfly Graph Size 7/8,4246,36.96
16602,NEW GIRLS 'HELLO KITTY' PRINCESS LIGHT PURPLE SHORT SLEEVE T/SHIRT SIZE 4,16602,26.16
4924,Girls' T-Shirts Hello Kitty Lalaloopsy Minions Pok'emon Secret Life of Pets NWT,4924,48.39
2259,New Nike Big Girls Short Sleeves T Shirt Grey White [Choose Size],2259,39.53
6207,NWT UNDER ARMOUR ALLERGIC TO HATERS SHIRT GIRLS YOUTH SMALL HYPER GREEN,6207,63.49
11514,NWT Girls Under Armour Shirt Size 4,11514,37.33
7953,JORDACHE Girl's Short Sleeve 2Fer Shirt with Lace Vest Butterfly Blue 6-6X,7953,17.11
13546,Art Class Girls' Rib Knit T-Shirt Short Sleeve Green/Black/Cream Stripe XS 4/5 ,13546,37.33
1366,NWT Gymboree Sweet Treats Striped Rhinestone Heart Top Girl's Sz 8,1366,50.41
14058,NWt girl sz M 7-8 Faded Glory chiffon button down shirt Aqua wave turquoise,14058,29.89
467,Reindeer Truck  - Youth Girl Short Sleeve Curved Hem Tee,467,74.7
3781,JAMES DEAN Juniors Girls Kids Short Sleeve T-Shirt BLACK HEATHER AGAIN,3781,74.7
6374,LORO PIANA GIRLS' PLEATED COTTON SHIRT-SIZE 8-MADE IN ITALY-RETAIL $450,6374,420.38
9768,LOT OF 2 MOSSY OAK GIRL'S SHORT SLEEVE CREW NECK T-SHIRTS - PINK PURPLE - XL,9768,24.48
9784,GIRLS S 5 6 PINK SILVER SPARKLE HEART ANGEL WINGS SHIRT NWT THE CHILDREN'S PLACE,9784,22.38
5445,"NFL Girls Amari Cooper Oakland Raiders V-Neck Short Sleeve T-shirt, Gray, Medium",5445,48.54
2047,NWT NIKE GIRLS Med Tee T shirts top black gray short sleeve athletic cut ,2047,91.55
10213,Gymboree Parisian Afternoon White Shirt Top Blue Glitter Dog Scarf Sz 4 5 6 NEW,10213,36.73
11198,NWT Girls Short Sleeve Smiley Face Shirt  Size Medium,11198,14.91
8264,NEW GIRLS POKEMON T SHIRT SIZE L 10/12 WHITE SHORT  CAP SLEEVES GOTTA GO CATCHEM,8264,37.33
2329,Bebe Girls Tank Top Size S (7-8) Pink (NWT Retail $30),2329,56.01
14990,"NWT My Little Pony Girls Pullover Top, Size XL(14-16), ""Pony Power"" theme",14990,36.62
16073,Bath Sheba Girls Blue Red Cotton Printed Top Shorts Size 6 8 NEW LOT 2,16073,93.38
495,NEW GAP EMBELLISHED GRAPHIC BLUE TOP TEE SIZE XS 4/5 S 6/7 M 8 L 10,495,72.87
14130,"Girls' Nebraska Huskers T-shirt, White & Red, Polka Dot & Stripes, Cute Gift! ",14130,33.59
6137,NEW Adidas Girls' Short Sleeve Tee - WHITE PINK,6137,36.13
5928,"New Girls Marilyn Monroe Fashion Short Sleeve Shirt Top, Blue",5928,37.37
2898,ACDC Juniors Girls Kids Short Sleeve T-Shirt BLACK STIFF,2898,78.43
14376,Rothco Camo Army Star Tee Shirt Girls White T-Shirt Soft NEW,14376,37.33
2232,UNDER ARMOUR Girls Rush Split Logo L/S Graphic Tee *True Grey Heather - 6X* NWT ,2232,55.86
287,MY LITTLE PONY PURPLE UNICORN GIRLS THE PRINCESS TEE SHIRT S-XL,287,74.55
9860,AIR JORDAN JUMPMAN YOUTH GIRL'S SHORT SLEEVE WHITE & BLACK SPARKLE T-SHIRT SZ 4,9860,53.21
10416,NWT Washington Redskins Girls T-Shirt Size 6 6X Love NFL Short Sleeve Football ,10416,27.99
2552,Juicy Couture Girl's Blue Zebra Crest Shirt Top Girl Size XS 5 - 6 NEW,2552,74.7
8703,"New Tea Collection Girl's Mahubala Flutter Tank Top, size 6",8703,48.58
3342,Lost Gods 4th of July Watercolor American Flag Girls Graphic T Shirt,3342,70.81
14567,NWOT authen ‘CBGB’ CLUB pnk/grn 'preppy' cott Girls T-SHIRT Sz M (8-10) Orig $24,14567,22.42
16653,NWT Abercrombie & FitchKids Girls Sz 9-10 Short Sleeve Logo Graphic Tee af kids,16653,63.49
1187,Calvin Klein Jeans Girls Jersey Short Sleeve Plaid Hem Flounce Top Medaqua 4 6 7,1187,47.83
9368,"New Minions Despicable Me girls shirt ""one in a Minion"" white size Small 6/6X",9368,37.33
14686,Girls Xersion Sz Small (7/8) Quick Dri Blue Activewear Top NWT  ,14686,18.61
5464,"NWT GIRLS GYMBOREE SZ 5 SHIRT, SHORTS DESERT DREAMS",5464,70.96
11603,NWT Lego Batman Movie Batgirl T-shirt Girl Size 7-8,11603,33.59
11946,New Disney Store Mickey Mouse Vampire Halloween Glow In Dark Size 10/12 Tee,11946,44.35
6118,Da-Nang Surplus Kids Summer Shirt/ Top /Tank LOVE BERRY 5SJC177954 X-SMALL XS,6118,72.41
3544,Lost Gods Boombox Cat Cartoon Girls Graphic T Shirt,3544,70.81
14212,Ed Hardy True Love Tee (6 years) Purple,14212,43.72
11536,NWT GIRLS SEQUIN HEARTS ORANGE SHORT SLEEVE TOP SIZE M TASSLES AZTEC,11536,29.86
11767,GIRLS S 6 7 WICKED PURPLE SHIRT LARGE BOLD WHITE OLD NAVY EUC ~ OLD NAVY,11767,22.38
12026,"Epic Threads Girls' Solid Cropped Tee, Fuchsia Purple, Size M",12026,33.59
5072,Champion Little Girls High-Low Hem T-Shirt Granite Gray Heather Size 3T - NWT,5072,51.53
15936,Hanes K010 Girls Essential Tee: - Choose SZ/Color.,15936,89.19
8923,Little Girls' Short Sleeve Sassy Cute Classy Cotton Raglan Top T Shirt BLACK 5,8923,98.95
4984,New Disney Girls Minnie Mouse Glow In The Dark Halloween T Shirt Size Medium 7-8,4984,74.7
849,New Boutique Brand Bella Bliss Pink Gathered Front Shirt  ~  Girl's 12Y,849,56.01
15833,Under Armour Girls London Orange Dry Fit Logo Top Size 12M 24M $15.99,15833,48.54
2787,MEGA MAN Juniors Girls Kids Short Sleeve T-Shirt WHITE BLUEPRINT,2787,74.7
8307,NWT Gymboree Stripes & and Anchor Girls Allover Anchor Top 5 7 Girls Blouse,8307,33.59
11208,"Puma girls active t shirt PGM27180 S Blue Atoll ""Win Like A Puma Girl"" NWT *^",11208,26.68
10979,Nike Girls JDI Short Sleeve Shirt - 921111 - White 100 - Size S - NWT,10979,37.33
4840,NWT UNDER ARMOUR LOOSE FIT BIG LOGO SHIRT PINK PUNK GIRLS LARGE,4840,67.22
15115,New Izod Schoolwear girl shirt size L red,15115,29.86
3121,Girl’s Art Class Short Sleeve T-Shirt NWT ORANGE LARGE (12/14),3121,42.67
2851,NEW GAP EYELET CUFF GRAPHIC TEE TOP SIZE XS 4/5,2851,72.87
6794,New Gymboree Cherry Cute white s/s shirt cherry girls 4,6794,50.82
1181,Crazy 8 Girls Dress Chambray Size 6 New Tunic Shirt Blue,1181,57.13
3330,Halloween Purple Shell Bra Costume White Youth T-Shirt,3330,55.86
15775,Under Armour Girls Black Never Slow Down Dry Fit Top Size 2T 4T 4 5 6X,15775,48.54
13431,NWT Old navy Girls Cobalt Blue Top Size 10/12,13431,22.38
477,Lularoe Kids Gracie shirt Disney Snow White Seven Dwarfs Black Size 6,477,81.46
10490,Justice Girls Exclamation Embellished Sweater. Size 5. NWT ,10490,27.99
3553,***New*** KIDS Kerusso Cute KDZ1372,3553,48.54
766,NEW H&M STUDIO COLLECTION GIRLS DESIGNER TOP SIZ 4-6  FANCY/HOLIDAY PRE MOSCHINO,766,216.73
7631,Girl Epic Threads Pink & Gray Striped Short Sleeve Knit Casual Top SiZe M NWT!!!,7631,29.89
12993,Gymboree Girls 5 Yellow Short Sleeve Top,12993,33.59
568,NEW Itsa A Girl Thing Red Tis The Season Christmas Tree Mason Jar Top Shirt S,568,56.01
4094,NIKE PRO COOL FITTED DRI-FIT SHIRT MEN SIZE XL NWT $35.00,4094,108.33
5324,Sottocopert New Girls TEEN RIBBED SS TOP  w/ LACE TRIM Shirt Sz 14 RTL: $70 R166,5324,111.91
4244,"Girls $19.99 IZOD White, Red, or Navy Polo Uniform Shirts Size 4 - 6X",4244,37.37
15070,GYMBOREE NEON YELLOW AND WHITE STRIPE SHIRT SIZE 4 NWT  spring / summer,15070,18.65
16492,NEW ATHLETIC WORKS TOP GIRLS SIZE 4/5  LIBERTY ROCKS,16492,11.17
10276,GIRLS XS 4 BLACK SILVER SASSY CONFIDENT FASHIONABLE SHIRT ~ THE CHILDREN'S PLACE,10276,22.38
15351,"Disney Frozen ""Snow Bros"" shirt, Olaf & Sven, Sz. Md",15351,31.76
10483,New Under Armour Charged Cotton Heat Gear Shirt Top YLG 14-16 ,10483,67.22
15966,Epic Threads Girls Striped Graphic T-Shirt outerbanks 3T - Toddler,15966,30.49
10439, Chocolate chip cookie t-shirt secret cookie stache girl's 10/12 layering new,10439,26.12
8769,BNWT Beautiful Designer JUICY COUTURE Girls Top Pink XL-12/14 ,8769,186.8
11139,"Ralph Lauren South West Graphic Girls T-Shirt, Size 4T, Carlyle Blue",11139,71.0
7877,G3T6555 Rock & Roll Cowgirl Girl's Rodeo Princess Graphic T-Shirt - Pink NEW,7877,74.7
11343,"NWT Girls Short Sleeve Shake It Up ""City Beat"" Shirt Size S (6/6X)",11343,14.91
8018,New NERDY  NINJA Math Kid's Girl's T-shirt Tee   Blue Stars & Sprinkles M ,8018,37.37
10464,"Disney Store Girls - Finding Dory - "" Bubble Buddies"" Short Sleeve T-Shirt, Blue",10464,56.05
13606,Girls Shirt Sz S 4 SS Gray Cotton Blend BFF Transfer All Seasons Total Girl NWT,13606,26.16
4383,"Brand New Girls White, Black & Yellow Nike Shirt, Size L",4383,52.13
15726,L.O.L. Surprise! Girls' Short-Sleeve T-Shirt 4-Pack ,15726,324.31
2798,"Girls Nike Short Sleeve T-Shirt Dri- Fit Cotton White ""Just Do IT"" Size M, L, XL",2798,42.79
5990,Disney Store Tsum Tsum #ADORBS Organic 100% Cotton T-Shirt - Girls XL 14,5990,70.96
7538,"NWT Cherokee PINK & White Rugby Stripe T Shirt , TOP Girl XS 4 5",7538,48.39
6008,"Knit Works Tunic/Top, Sz L, XL: Girls Screen Print Front Decor, Short Sleeve",6008,53.66
3378,RESIDENT EVIL Juniors Girls Kids Short Sleeve T-Shirt BLACK RESIDENTEVIL 2,3378,74.7
7980,Under Armour Girls' Siro Threadborne HeatGear Short Sleeve Tee Gray/White Sz YL,7980,85.94
1091,Polo Ralph Lauren Girl's Plaid Top~Red/Green Tartan~Black Buttons~SS~Size 6~NWT,1091,85.91
14410,"Girls Size 7/8 Top hot pink, metallic silver, Gray ""LOVE"" by bobbie brooks NWT",14410,16.63
15738,Justice Girls University Of Connecticut Graphic T-Shirt grayredblue 6,15738,71.71
14735,GIRLS 2 PC SHORT SLEEVE DOUBLE LAYER STAR TANK SET SIZE L/XL BY KNIT WORKS NWT,14735,15.69
12968,Disney Pixar Inside Out Kid Girls Purple Glitter Short Sleeve T-Shirt Top 6/6X,12968,26.12
6378,Arizona Co. Girls Short Sleeve Mock Vee Top Shirt Panama Rose XL/18 NEW,6378,41.51
13293,"ROXY GIRLS SIZE SMALL WHITE SHORT-SLEEVE TOP, SHIRT, NWT",13293,44.84
5743,NEW The Children's Place Girls S 5 6 Shirt Tie Dye Top,5743,63.34
2936,Lost Gods Earmuff Dog Girls Graphic T Shirt,2936,70.81
10865,NWT Children's Place Short Sleeve Horse Graphic Tee Girl's Medium 7/8 Cute,10865,33.59
4061,BRUCE LEE Juniors Girls Kids Short Sleeve T-Shirt BLACK JKD MASTER,4061,74.7
8828,"Under Armour Girls HeatGear ""TOO GOOD TO IGNORE""  Black YXS Loose SS NWT",8828,48.46
11726,RBX Strong is Beautiful Girls Small (7/8) Pink Tee w/ Headband NWT ,11726,37.33
15340,$14.95 Gap Kids Black 100% Cotton Tshirt  Top - Size Ml (8),15340,14.91
3788,LOVERBOY Juniors Girls Kids Short Sleeve T-Shirt BLACK TURN ME LOOSE,3788,78.43
4558,"Monteau Girls' Graphic Print T-Shirt, Ivory, Size XL, MSRP $24",4558,48.54
4834,***New*** KIDS Kerusso -- Flying Solo KDZ1855,4834,48.54
14401,Disney Frozen Elsa T Shirt Navy Blue Fruit Of The Loom New,14401,70.96
13154,"NWT Girls Sz: 14/16, Short Fila Purple Tee, Cotton Blend",13154,26.12
8094,Gymboree Girls' Ballerina Tee NWT GYM21,8094,67.22
9144,WALT/DISNEY/WORLD~girls~MICKEY/MOUSE/GLITTERY/SILK/SCREEN/T/SHIRT! (M) N/W/TAGS!,9144,52.28
361,Lost Gods Daisy Heart Girls Graphic T Shirt,361,70.81
9046,"New with Tags - Nike Dri-Fit Boys, M, BlacK, Authentic Soccer Top, MSRP $65.00",9046,67.22
12642,"The Children's Place Aqua Blue T-Shirt Sunglasses ""Cool"" ""Peace"" Size XS (4) NWT",12642,37.33
248, Ralph Lauren Dutch BLUE POLO Shirt Girls Sz 7 NWT $29.50 100%cotton,248,67.22
2566,Wild Bobby Floss Like a Boss | Rainbow Unicorn | Girls Pop Culture T-Shirt,2566,48.54
12693,Everyday Favorites Girls Gymboree Basic Navy Shirt Top Size 4 NEW NWT School,12693,37.33
8884,"Girls Cat & Jack Ruffle Short Sleeve Shirt Pink/Violet 4-5,10-12, 14-16 (3635)",8884,37.33
7961,Army Navy Air Force USAF Marines USMC Military Youth Size T Shirt ,7961,37.33
15176,Girls Levi's Red Tab JEans Red Short Sleeve T Shirt NWT NEW Size L,15176,29.48
265,Disney frozen Graphic tee shirt (size 4),265,74.7
3411,CBGB Juniors Girls Kids Short Sleeve T-Shirt GRAY HEATHER CIRCLE SCENE,3411,78.43
10678,"New Guess Shirt, Girls, Light Blue, Short Sleeve, Size 4",10678,48.54
9929,CONVERSE GIRL'S CHUCK TAYLOR ALL STAR PINK BLACK SHORT SLEEVE T-SHIRT (5) 4-5YRS,9929,49.66
14752,IZOD Approved Schoolwear Girls Navy Blue Short Sleeve Polo Size Large 14/16,14752,14.95
8893,"NEW LEVI'S GIRL'S ""I LOVE NY LEVI'S"" GREY HEATHER SHIRT SZ 6 (M ) 5-6 YEARS ",8893,49.66
10510,GIRLS S 5 6  STRIPED GRAY & MILK HOOD POCKET SHIRT NWT ~ THE CHILDREN'S PLACE,10510,29.86
2192,Authentic Abercrombie Kids—Girls Embroidered Top—Pink w/Shine—Originally $29.95,2192,93.38
8456,Nike Air Jordan Girls Jumpman Top T-Shirt  Tee Size Med.,8456,63.49
15134,New Nike Size S Girls T-Shirt Pink Cotton Just Do It New With Tags ,15134,33.59
844,NEW Lularoe Kids Top Gracie Short Sleeve Size 12 4th of July Red White Blue Star,844,88.56
14595,Roxy Kids Sz 5 Shirts Tops Roxy Sun Ivory,14595,59.75
14053,NWT Nike Girls Tee Shirt-Gray/White Lettering-Size Medium- Athletic Cut-0805**,14053,29.86
13505,NWT Girl's Minnie Mouse Fashion Top Size 4/5,13505,29.86
2052,Girls UNDER ARMOUR Athletic Short Sleeve Shirt Turquoise Blue Size YOUTH XL NWT,2052,70.44
6016,Gymboree Prep Perfect 8 10 Shirts U Pick Blue Bubble Just Be U 2014,6016,52.43
4712,SAVED BY THE BELL Juniors Girls Kids Short Sleeve T-Shirt BLACK BAYSIDE CLAWS,4712,74.7
393,Abdominal Snowman - Youth Girl Short Sleeve Curved Hem Tee,393,74.7
9843,"AIR JORDAN YOUTH GIRLS ""YOU RUN I FLY"" SHORT SLEEVE DRI-FIT SHIRT.SZ M 10-12 YRS",9843,53.21
2025,NWT Hanna Andersson Peanuts Snoopy T Shirt Top Football Cheer Size 150,2025,67.26
12930,NWT Girls LUCKY BRAND Maisie TEE Shell Pink Size Large,12930,53.96
13249,NWT J. Khaki Preschool Girl's 4 Pink Purple Polka Dot Embroidered Koala Shirt,13249,37.25
6806,NWT U.S.Polo Assn. Girl's Shirt Short Sleeve Blue With Silver Button Down 13-14,6806,52.28
15054,NBA Girls 7-16 Detroit Pistons Middle Basketball Short Sleeve Tee M 10-12 Blue,15054,37.33
9093,ROXY GIRL BY QUIKSILVER ZIGZAG TEE SHORT SLEEVE SHIRT SZ S (8-10) ,9093,53.21
698,Valentine's Day Love Horse Hearts Girls T-Shirt Top Kids Youth X-SMALL XS 4/5,698,41.07
13125,"Disney Princess Belle Tee T-Shirt Short Sleeve Graphic T-Shirt Girl Size XS, S",13125,37.33
5376,Ed Hardy - Butterfly Girls Youth T-Shirt,5376,67.26
8096,NWT JC PENNY GIRLS ARIZONA SHIRT SIZE 18 WHITE WITH A LITE BLUE DESIGNS ,8096,22.38
12536,Brand New Disney Frozen Elsa Child Large T-Shirt ~Blue~ Free Shipping!,12536,37.33
6586,Under Armour Girl's Big Logo Striped T-Shirt Blue SIZE XLarge 18-20 MSRP $24.99 ,6586,63.49
16138,NWT Gap Kids girl navy t-shirt w/multicolored geometric print arch logo; size XL,16138,59.75
5732,"NWT Girls NIKE Short Sleeve T-Shirt, JUST DO IT, Large L, FREE SHIPPING",5732,40.77
2153,New My Little Pony shirt girls sizes X-Small - X-Large My Little Pony shirt,2153,41.07
1134,Mini Boden Girls Size 11-12Y Fun Animals Rollerblading Cat And Dog T-Shirt,1134,85.76
12607,U.S Polo Assn. Junior's Polo Shirt Pink Size Large NWT DC2,12607,37.14
1965,New with Tags Authentic Trunk Ltd. Youth Girls Van Halen Hi-Lo Dolman T-shirt ,1965,55.86
7216,NEW JUSTICE GIRLS SIZE 10 12 16 18 FLORAL CIRCLE SHIRT/TOP W/CAMISOLE&NECKLACE,7216,48.54
833,❤ GYMBOREE kitty applique shirt size 12 New $26.95 navy polka dot NWT FREESHIP,833,67.07
693,The Flash Bolt Symbol All Over Sublimation Junior T Shirt,693,119.39
5233,DEVIL MAY CRY Juniors Girls Kids Short Sleeve T-Shirt BLACK FACE YOUR DEMONS,5233,74.7
4933,"New Girls Yellow & Blue Under Armour Heat Gear Shirt, Size M",4933,52.13
8636,Disney Youth Girls Blue Frozen Anna & Elsa Short Sleeve Shirt Size Medium (7/8) ,8636,33.59
15468,Girls Small Pink Top 2 Piece Top With Necklace Knitworks Brand New,15468,26.16
3792,NWT NEW JUICY COUTURE 8 GIRLS GRAY PUPPY DOG SHIRT,3792,186.8
6228,"NWT Gymboree Uniform Navy Blue Shirt,Top Short Sleeve Girls Polo 7",6228,61.66
7173,New Disney Frozen Shirt Tee Girl's L 10-12 Pink Top Anna Elsa,7173,47.61
11976,5Th & Ocean Girls MLB Los Angeles Angels Short Sleeve Graphic T-shirt Sz L10-12,11976,22.42
9135,Gymboree NWT Girl With Puppy Tee Size 4 (Pretty Posies),9135,41.07
12803,L O L Vintage T-Shirt Tee Youth Girls M  PEACE Sign Short Slvs Cotton Poly - NWT,12803,52.31
11879,NWT *$16.99 HAPPY KIDS FOR KIDS LAS VEGAS Top Size Small (4) “Queen Bird” Rose,11879,35.46
12813,usta jr. team tennis shirt girls XL,12813,41.1
1747,NEW SANRIO HELLO KITTY SPARKLY GRAPHIC TOP TEE SIZE 4 5,1747,69.13
7221,LOL Surprise Dolls Glow in the Dark Short Sleeve T-Shirt Size S 6-6X,7221,33.59
1006,NWT Life is Good Crusher Pink Horse Different Color Girl 10 L Cotton T Shirt New,1006,93.23
14435,NWT girls xl sz 14 short sleeve green colored shirt Old Navy Brand great cond,14435,14.95
12017,WEST VIRGINIA UNIVERSITY WVU MOUNTINEERS Girls New T-Shirt Size LARGE,12017,31.72
4018,The North Face Boys SS Blue Pocket T Shirt XL (18-20) NWT,4018,52.28
15006,NWT Girls size 4/5 short sleeve Top !!!!,15006,14.95
13382,NWT ~ 2 American Girl Black Shirt ~ size M 10-12 Ruffles Silver & Red Stars Top,13382,29.86
5799,NWT Old Navy Girls Heart-Print Peplum-Hem Top M (8) $20.94 Shirt Blouse Black,5799,63.49
3873,Lost Gods Official Easter Egg Hunter Girls Graphic T Shirt,3873,70.81
11249,NWT Girls Short Sleeve Smiley Face Shirt  Size X-Large,11249,14.91
431,New Justice Girls Glitter Rainbow Clouds For Like Real Top Tee  14 year ,431,44.84
10597,JUICY COUTURE GIRLS WHITE SCRIPT LETTER GLITTER T SHIRT $38 SIZE L 10-12 BNWT,10597,74.7
2650,Matilda Jane Its A Wonderful Parade Marching Tee Size 14 NWT,2650,61.47
11335,Gymboree Mix N Match Blue FLOWER Swing Shirt Small 5 6 Kid Girls NWT,11335,37.18
8120,NWT Abercrombie Girl XL Totally Over It Cat Graphic Tee Kitty Navy Top LAST ONE!,8120,74.7
4813,Nike Girls Tech Fleece Crew T-Shirt  Ref: 816375 Color: Verde/Amarelo Size XL,4813,74.7
11352,Miss grant White Short Sleeve Tshirt Top With Bow And Rhinestone Heart BNWT $108,11352,168.15
6571,Twirl Girls Top Sz 12 White Glitter Butterfly Short Sleeve T-Shirt Casual School,6571,55.79
9479,BATON TWIRLING T RAINBOW RHINESTONE STAR TWIRLER MAJORETTES ADULT CHILD TWIRL,9479,49.25
7069,NWT~~ Matilda Jane Girls Size~4 Friends Forever Odette Flutter Top Tunic,7069,112.06
4476,Disney Frozen Girl's Elsa & Anna Pink Striped Glitter Short Sleeve T-Shirt,4476,52.13
406,Justice Girl's Size 20 CHRISTMAS PUG Graphic Tee in Red New with Tags,406,57.13
1925,"Splendid Girls Size 10 White T-Shirt, New With Tags",1925,48.58
760,NEW Vtg 1960s Lot of 2 Sugar Spice Cropped Belly Showing Summer Tops Girls 6/6X,760,70.96
9170,Girls  XS (4/5) Star Wars Romper-Disney,9170,67.22
23,NWT Girls Justice Short Sleeve Light Pink Top w/Cats ,23,61.66
11647,Cherokee Girls Plus Size Striped Tee Medium (7/8) Plus NWT,11647,27.09
9546,AIR JORDAN YOUTH GIRL SHORT SLEEVE COTTON DRI-FIT PURPLE SHIRT SZ 6  5-6 YRS ,9546,60.31
4001,NEW Nike Girl's Sz Large Black Run That Graphic Active Tee Short Sleeve T-Shirt,4001,70.55
14322,"Circo Girls Heart or  Musical Note Shirt Sizes S 6-6X, M 7-8 girls tops NWT",14322,33.97
14187,Hanes Sport™ Girls' Performance Tank OK301,14187,26.16
3678,FINAL FIGHT Juniors Girls Kids Short Sleeve T-Shirt NAVY FINALFIGHT,3678,74.7
15624,Justice Girls Jacksonville Jaguars Graphic T-Shirt,15624,70.32
15439,Classroom Back to School Round Collar Peter Pan White Blouse Size XL (18/20),15439,33.59
1207,Oshkosh girl's pink gymnastics graphic tee sparkly gems 6X NWT,1207,55.86
8978,"Bossini Short Sleeve Word Print Casual Girls Tee Top - Blue,Size 3t - 16",8978,27.73
5898,Browning Girl T-Shirt Purple Silver Print Heart Short Sleeve Youth XL,5898,48.39
7044,"JoJo Siwa t shirt, JoJo bows personalized birthday shirt, girls birthday shirt",7044,48.54
8141,AIR JORDAN FLIGHT YOUTH GIRL SHORT SLEEVE COTTON PURPLE SHIRT SZ XL 13-15 YRS ,8141,53.25
12396,Black UNDER ARMOUR Girl's YLG Fast Lane Short Sleeve UA Logo Shirt Top 1272085 L,12396,37.33
13141,Disney minnie mouse black gray t-shirt NEW 10/12,13141,37.29
5997,"NWT Girls Plus SO Cap Sleeve Crop Top, 18 1/2, 20 1/2 ",5997,40.36
12557,*** TCP CHILDREN'S PLACE Green Glitter St Patrick's Day Shamrock Tee Shirt S 5/6,12557,14.95
9127,Disney Frozen Olaf JUST CHILLIN White T-shirt Size 6/6X Girl's NEW,9127,67.22
2087,Nike Air Jordan Girls Jumpman Top Tee T-Shirt Size Med.,2087,59.75
6023,"New Girls Marilyn Monroe So Chic T-Shirt, White, 4-6x",6023,37.37
3653,Lost Gods Reindeer Tree Ugly Christmas Sweater Print Girls Graphic T Shirt,3653,70.81
1380,~NEW~ 8th BIRTHDAY GIRL 8 Years Girls Graphic Shirt 7-8 Medium Gift! Purple SS,1380,56.01
7196,NWT GAP Kids Girl Blue White Graphic Tee Shirt Top 2-PC Set Sz XS 4-5,7196,33.59
11429,Cheerleader Sparkle We've got Spirit yes we do. Short Sleeve T Shirt Size YLarge,11429,28.36
10367,Disney Store Minnie Mouse Bow Sparkle Black T-shirt Size 5/6 Girl Christmas gift,10367,37.33
7292,GYMBOREE BURST OF SPRING CORAL SEQUIN SPARKLE S/S TEE 4 5 6 7 8 9 NWT,7292,33.59
9971,NWT Girls Xhilaration Gray Rainbows Short Sleeve Top XS 4/5,9971,25.6
15758,Aeropostale Girls Sequined PSNY Embellished T-Shirt,15758,30.12
12397,Crazy 8 by Gymboree sparkle elephant  top size 7-8  10-12 14,12397,37.33
4373,The North Face Boys SS Dark Gray TNF Shirt L (14-16) NWT,4373,52.28
7064,NWT Gymboree Charm Class Size 8 Navy Blue Pink Flower Shirt Top,7064,52.31
6069,LIFE IS GOOD Girl's Instant Message Crusher Tee Shirt S(5-6) NWT Free Shipping,6069,52.28
16622,Golden Girls T-Shirt Super Nice size large,16622,56.05
11080,Gymboree Everyday Wear glitter Just Kickin' It tee t-shirt top girls NWT XL 14,11080,22.38
16092,New Yellow Short Sleeve Princess Belle Beauty & the Beast T-Shirt Girls (4- 6x),16092,59.6
15611,Aeropostale Girls West 34th St Graphic T-Shirt,15611,29.63
5587,NWT Girl's Brandy Melville Gray Ribbed Shorts Sleeve Top OS,5587,74.7
2628,Columbia YOUTH WONDERFUL WANDER™ TEE for Girls Size: L (14/16),2628,93.38
12500,GIRLS MULTI-BRAND X-LARGE 2-PACK SHORT-SLEEVED T-SHIRTS,12500,56.05
8995,NWT Adidas Girls Black Graphic T-Shirt Size XS- 7/8,8995,48.54
16631,GIRL'S  TOP ~SPEECHLESS ~ SIZE LARGE   ~ NEW ~,16631,41.07
16618,ADIDAS Official MLS SOCCER Girls BLACK BURN OUT DC UNITED TEE SHIRT NWT  L  14,16618,47.61
12163,GYMBOREE NEW Girls Rock Popstar Academy Heart SS TShirt Tee Top NWT Size 5,12163,37.33
224,NEW Disney Colorful V Neck Bling Mickey Mouse Girls Tee Shirt Sz S 5/6 XL 14/16,224,69.13
12093,New with Tags Girl's BCX Girl Shirt Size Small Navy Blue Collared Blazer Jacket,12093,63.49
14688,Old Navy Pink Starred Short Sleeve Shirt for Girls- Size XXL (16 Plus) - New NWT,14688,33.59
697,GAP KIDS GIRL GapKids Wonder Woman™ strap-back tee NWT Large (10) NNN,697,56.01
15772,Under Armour Girls Blue Infinity Cheerleader Dry Fit Top Size 4T 4 6 6X,15772,48.54
447,Better Not Pout - Youth Girl Short Sleeve Curved Hem Tee,447,74.7
