id,title,file_id,price
902,Lost Gods Penguin Heart Girls Graphic T Shirt,902,70.81
10746,NEW NIKE Girls JUST DO IT T Shirt SIZE S $54,10746,37.25
6132,"The North Face Girls' Graphic ""HELLO WORLD"" Black T-Shirt - MEDIUM (10/12) - NWT",6132,59.41
5348,NWT DISNEY SHIRT FAMILY VACATION MICKEY & PALS YOUTH SIZE S BLUE WITH DARK BLUE,5348,93.38
4230,New Ralph Lauren Childrenswear Polo Cotton Graphic Tee Shirt ,4230,48.54
15514,Girls Beautees Top Size Large Pink Coral W/ Butterflies & Sequence NWT H91,15514,18.5
9282,Southern Mississippi Golden Eagles Girls Shirt 7 / 8 Youth Black Gold,9282,28.66
8985,Love Shirt Size S 6-6x Brand New NWT Zone Pro Shirt,8985,41.07
1118,Justice Girl's Emoji Lace Up Top in Blue Size 14 Plus NWT,1118,57.13
2682,New OshKosh Striped Back and Elephant Sparkle Front Tee Top Size 8 Year NWT ,2682,44.84
9483,Girl's Light Baby Blue Cute Kitten T Shirt Choose Your Size White Kitty Cat NEW,9483,33.59
12684,Gymboree sunny citrus sweet tart size 7 8 9 10 12 NWT  ,12684,37.33
5201,GIRLS PUMA COLD SHOULDER STYLE GREY SHIRT MULTIPLE SIZES NEW WITH TAGS MSRP $24,5201,51.45
12532,"Kathy's Clown Girls ""Red Hots"" Shirt Size 8",12532,14.95
12045,NEW Gymboree Size 5 Short Sleeve Shirt Blue White Striped T-Shirt Pocket Girls ,12045,37.33
16273,French Toast Girl's Short Sleeve Stretch Pique Polo Top School Uniform S 6/6X,16273,33.59
6321,KIDDO BY KATIE BEIGE TAN OPEN WEAVE PULLOVER TOP GIRLS SIZE 7 NWT  ,6321,41.07
11454,NWT Size 12 Persnickety Ally Tee in Red,11454,93.42
10827,"NWT Girls Short Sleeve ""Glam"" Shirt Size 5",10827,14.91
13343,NWT Girls Arizona Brand Top Size 14/16,13343,26.12
6709,"Monteau's Max & Riley Girls' Crochet-Sleeve Handkerchief-Hem Top, M(10-12), $34",6709,48.54
15314,"Disney Store ""Inner Strength Outer Sparkle"" Princess Tee Kids Size  5/6 New",15314,26.04
14830,Girls Faded Glory Peach Blouse (M),14830,18.68
14852,NEW Sz 4 Disney Frozen Shirt Olaf Some People are worth Melting for cute,14852,14.16
266,Brand New Bella Bliss Red/White Stripe Horse Applique Shirt Boy's Size 6,266,70.59
15320,Girls' Children's Place White & Black Glitter Dad for President Size XL,15320,18.65
10629,Children's Place Ruffle Neck Faux Layered Shirt ~ Size Small (5/6)  ,10629,29.71
5699,Victory Royale Dance Floss Like A Boss Girls Gaming T-Shirt Funny Gamer Tee,5699,48.54
14982,Cat and Jack Girls Size Large SS T-Shirt Light Blue with Rainbow Star Graphic,14982,22.42
6373,OSHKOSH B'GOSH GIRL'S JUST SMILE RUFFLE HEM TUNIC MINT SIZE 4 NWT,6373,53.77
15765,Aeropostale Girls Glitter PSNY Graphic T-Shirt,15765,30.12
5288,"POLO Ralph Lauren TODDLER Girls Cotton Short Sleeve Crewneck Top Shirt, size 6",5288,58.74
8795,NWT Polo Ralph Lauren GIRLS POLO SHIRT MU PREP PR STRIPED XL(16) #72,8795,74.7
10617,GIRLS XS 4 WHITE HEART BUTTERFLY LOVE IS AIR SHIRT NWT ~ THE CHILDREN'S PLACE,10617,26.12
5984,New Girls L 14 16 I Fight For Breast Cancer Shirt Gray Pink Personalize It New,5984,49.88
14828,OshKosh B'Gosh Girls Shirts - Size 6X,14828,20.89
15840,Aeropostale Girls PS New York Graphic T-Shirt,15840,30.12
7070,Disney Princesses - Face Frame Juvy Girls T-Shirt,7070,48.39
12505,Girls *Summer~Time* top lot of 2 sz 14-16   LOOK:)  NEW!    back-2-school,12505,44.84
12457,ARIZONA JEANS CO JUNIORS CROPPED ASYMMETRIC HEM CARDIGAN WHITE MEDIUM NWT,12457,35.83
4658,SPEEDO TOP TEE SHIRT GIRLS RASH SWIMING PINK SUN PROTECTOR 50+ UPF 8 10 12 NEW,4658,67.22
9704,Girls Hello Kitty t shirt White Q870583 Neon Rose S small TEE NWT ^^,9704,23.5
14391,ms1947- NWT STERLING Girls hooded Shirt sz Large,14391,24.29
16061,NWT Ralph Lauren girl heather rose t-shirt w/large navy polo player logo; size M,16061,67.22
15352,  T- SHIRT  ( SIZE SMALL),15352,22.42
14314,Hello Kitty Christmas Holiday Sparkle Glitter Shirt Girls Sz M - So Cute!,14314,44.84
5916,"Justice Girls Cold Shoulder Fashion Tee, Gray, New-Unique-Trendy $26.90, Size 16",5916,74.7
7434,Chaps White Button Down Top Blouse Size S 7 Ruffles School Uniform,7434,56.01
8108,AUTH Lacoste Girl Polo Shirt 14,8108,149.43
6514,NWT Gymboree Charm Class Size 10 Girl with Sparkly Hat Shirt Top,6514,56.05
4188,NEW SMURFETTE SMURFS RAINBOW I LOVE ATTENTION Turquoise Shirt Girl 6/6X,4188,56.01
3820,BON JOVI Juniors Girls Kids Short Sleeve T-Shirt BLACK RUNAWAY,3820,78.43
16397,Garb Performance Solid Polo Youth Girls Sz Small NWT Purple Short Sleeve,16397,8.89
238,Girl blouse peasant modest cotton red white gingham with lace size 10,238,93.38
11837,NWT Gymboree Girls Butterfly Flower Top Mix N Match Shirt Xs 4,11837,33.59
4127,French Toast Girl's Short Sleeve Interlock White Uniform Polo Shirt,4127,44.65
11704,Nike Girls FLY AND MIGHTY Short Sleeve Shirt 885092 - Pink 616 - L - NWT,11704,33.59
14411,XOXO Girls Shirt Size 6 White Pink Silver Heart True Love Embroidery NWT,14411,26.12
8426,LuLaRoe New GRACIE Size 8 Bomb Pops leggings material SOFT RARE UNICORN,8426,56.05
273,Lularoe Kids Gracie shirt Disney Sleeping Beauty fairy size 10 legging material,273,81.46
14120,DC Shoes Boys Gridify Tee (M) Red Y7620442,14120,38.11
13233,LOVE THIS LIFE GIRLS SHIRT SZ-XL (14),13233,36.4
16629,NEW Disney Tinkerbell Love Black Pink Blue Short Sleeve T Shirt Size 6 6X cLOSeT,16629,14.91
12277,"HIGH SCHOOL MUSIC 100% COTTON Yellow Short Sleeve ""SHARPAY"" Tee GIRL SIZES NWT",12277,3.7
8648,Baby Phat White Short Sleeve Tee T Shirt Little Girls Size 5/6 NWT $22,8648,61.66
14701, Old Navy Girl's Short Sleeve Lace-Shoulder Tee Size L 10/12 NWT,14701,18.65
16039,Reebok Girls 7-16 (Parigi) Big Zoom Up Short Sleeve Tee- Pick SZ/Color.,16039,59.79
9616,FIREHOUSE PINK HEART T SHIRT TOP SIZE 6/6X BRAND NEW SHORT SLEEVE,9616,52.28
4516,NWT NIKE GIRLS' GRAY HEATHER SWOOSH COTTON SHORT SLEEVES TEE SZ M AR0711-063,4516,44.47
803,New Hatchimals shirt girls sizes XS S M L XL Hatchimals shirt girls,803,56.01
1501,TOMMY HILFIGER NEW KIDS GIRLS GOLD STAR LOGO PRINT WHITE T SHIRT TEE M (8/10),1501,56.01
16071,"NWT Oshkosh girl lavender t-shirt w/""star of the show"" on the chest; size 8",16071,52.28
5385,Under Armour HeatGear UA Girl's Studio Crop Shirt Sz Youth XS NWT 1290862-001,5385,54.18
12852,Disney Pixar Inside Out Disgust Kid Girl Green S/S Graphic Tee T-Shirt Top 6/6X,12852,29.86
6785,"DISNEY STORE CAPTAIN AMERICA ""LOVE"" 10/12 LARGE  T-SHIRT *NEW WITH TAGS*",6785,47.61
6776,Under Armour New Men's Cotton BALL Black T-Shirt Tee Loose Fit Charget L NWT,6776,49.66
15446,Disney FROZEN Elsa Anna Gold Glittery Plum Sz 5 Girls TEE TOP T-SHIRT $20 ~ NWT,15446,33.18
14276,DISNEY Tsum Tsum Characters #BFF Girls Graphic DIY Color Me T-Shirt XL 14-16,14276,10.95
14243,Boy's Lucky Brand Gray T-Shirt Size 14/16-NWT,14243,37.33
6076,NWT Nike Air Jordan Girls' Jumpman Black Mesh Tee Size Large,6076,93.38
1037,Disney Store Minnie Mouse Rose Gold Fan Girls T Shirt Toddler Size 2/3 NWT,1037,55.3
347,NWT Boden Johnnie B Olivia Pink W/Green Polka Dots Top Size 11-12 year,347,64.42
15486,"Brand New Funky Diva Big Girls Short Sleeve Graffiti Print T-Shirt, Size Large ",15486,18.65
7633,NIKE MY TROPHY IS BIGGER THAN YOUR GRAPHIC TEE T SHIRT TOP YOUTH GIRLS M GREY ,7633,48.39
2859,Lost Gods Star Kitten Girls Graphic T Shirt,2859,70.81
16220,Nike FEELIN' FIERCE Neon Green Top Shirt * Sz 2T  *NWT,16220,41.07
3530,Girls Cat & Jack Short Sleeve Friends Forever Graphic T-Shirt Select Size (1938),3530,41.07
15879,Under Armour Girls S/S Pink Dry Fit  Logo Top Size 2T 4T 4 5 6,15879,48.54
8930,Candy Corn Applique Shirt,8930,97.15
14227,"NWT! ""CHEROKEE"" GIRLS PINK S/S SHIRT SIZE L (10-12) ",14227,14.91
12828,Juicy couture girls  4 T Shirt NWT velvety lettering 💕 Adorable ,12828,56.01
8208,Girls Princess Leia Star Wars Rebel Alliance Tsum TShirt Top Pink Size L 10/12,8208,29.89
15518,"NWT Arizona girls lace short sleeve top, hot pink, Size 5",15518,16.78
12275,Southern Grace Kids Beautiful All-American Southern Girl Tee Pom Poms Patriotic,12275,74.73
15975,LOVE BY DESIGN Girl Junior Top Size XL Chevron Tee White Black Stripe Blouse $30,15975,51.87
7049,NEW Girls Pokemon Charmander Squirtle Bulbasaur Fennekin Froakie shirt ~ L 10/12,7049,41.07
16460,NEW! 7th BIRTHDAY 7 Years Girls Graphic Shirt 10-12 Large Gift! Pink Nice! SS,16460,63.11
14229,New Disney pink s/s shirt girls 6 Mickey Minnie love,14229,28.36
16124,"NWT $49  Diesel kids t shirt ""tafini"" blue xl x-large",16124,67.22
1714,Gymboree Faraway Traveler Top 3 or 4 New Floral Beaded Caftan Shirt Girls Summer,1714,48.54
16487,Girls T-Shirt Childrens Size: M,16487,29.86
1916,Disney Emoji Girl's Lilo And Stitch Current Mood T-Shirt SV3 Pink Large NWT,1916,43.68
16345,"Reebok Little Girls' Short Sleeve Tee, 3018-White, 4",16345,47.05
4938,Ralph Lauren Girls Banner Stripe Short Sleeve Rugby Shirt Newport Navy Sz M-NWT,4938,93.38
13574,BOSSY Girls Tee Shirt Drop Back Neckline White Lace Bow US MADE Sz XL(14/16) NEW,13574,29.71
1112,Lost Gods Cheeseburger Love Girls Graphic T Shirt,1112,70.81
4833,***New*** KIDS Kerusso Whole Armor KDZ1428,4833,48.54
13475,"CLEMENTINE Girls Short Sleeve Basic Tee T-Shirt, Chill Light Green, 5/6 NEW",13475,17.82
8501,NEW Girls Cat & Jack Kitty cat Space Shirt Top Tee shirt NWT Size 4 5 year,8501,32.81
14616,Disney Moana Short Sleeve Black T-Shirt Girls Size 6 NEW with Tags,14616,24.29
12819,Epic Threads Girls' Pink Ruffle Tunic Top sz 6,12819,34.71
6255,Gap GirlsTaglan tee Green Size L (10) NWT,6255,74.7
2034,CHIN UP I Love You a Latte Girls Graphic T Shirt,2034,70.81
792,Wonder Woman I Am Wonder Woman Costume Sublimation Junior T Shirt,792,100.7
13066,NWT Gymboree Cherry Baby Rhinestone Cherry Stripe T S 5,13066,37.33
9946,"""Shoot for your Dreams"" girls 4/5 blue top",9946,18.68
12978,NWT Gymboree Desert Dreams Coral Top Sun Sets Road Trips Long Sun Sz: 7,12978,37.18
11739,Pink Island Girl Shirt Big Dogs Puppy Hut Palm Trees Hibiscis Flowers Cotton 6/7,11739,56.01
4152,MEGA MAN Juniors Girls Kids Short Sleeve T-Shirt HOT PINK MEGA GUNNER,4152,74.7
7779,NWT BABY GAP MODERN DANCE TEE BALLET SHOES T SHIRT BOWS RIBBONE 4T 4 BALLERINA ,7779,74.7
11401,Gymboree Aloha Sunshine Girls Size 6 Sunshine Sweetie Top Shirt Brown NWT NEW,11401,37.33
12132,Beauty and the Beast Girl's Belle Short Sleeve T-Shirt,12132,45.51
425,Girls Star Wars Porg Graphic Short Sleeve T-Shirt - White Glitter-S (6/6X) - NEW,425,29.86
3306,ACE ATTORNEY Juniors Girls Kids Short Sleeve T-Shirt ROYAL MOOD MATRIX,3306,74.7
5596,"AQUA Girls’ Plaid Shirt , Navy White Purple,Size L, MSRP $40",5596,59.75
15427,GUESS 81- GIRL'S GREY SHIRT SZ 6 NWT,15427,18.65
2089,POPEYE Juniors Girls Kids Short Sleeve T-Shirt WHITE POWEROLL,2089,74.7
2611,Nike Dry Girl’s Sz Medium Elite Tee Shirt Camouflage Printed T-shirt,2611,53.73
9541," Girls' Little Short-Sleeve Graphic Tee, Aqua Splash, L",9541,48.13
3681,STREET FIGHTER Juniors Girls Kids Short Sleeve T-Shirt BLACK FIGHT!,3681,74.7
5644,Lazy One Toddler Tee Shirt Stripes Brown Pink White Horse ,5644,55.86
14077,Roxy Kids Sz 5 Shirts Tops warm day Doggie,14077,71.74
14869,NWT Girls t-shirt large top 10-12 short sleeve gray with LOVE Old Navy stretchy,14869,14.87
7918,Nike Girl's Graphic Athletic  Short Sleeve T-Shirt NWT  Size 7 Hyper Charged,7918,56.05
694,Twin girls Old Navy PEACE SIGNS peach and aqua tops shirts NWT 5,694,55.86
10360,Rockets Of Awesome Girl's Rhinestone Star Top SD8 Eclipse Size 4/5 NWT,10360,33.59
9552,Girls Pink.multi Under Armour  Logo Top Sz 6x NWT ,9552,69.13
13987,Browning Girls Brown with Pink buck Tee Shirt new with Tags multi Sizes,13987,37.33
9385,NWT Girl's Disney Minnie Mouse Black Lace Short Sleeved w/ necklace design,9385,41.07
5430,Disney Store SISTERS FOREVER  Anna & Elsa Skating Short Sleeved BN Size 5/6,5430,44.8
3158,SHOPKINS TOP T SHIRT GIRLS - SPRINKLE SQUAD STAR PINK  SZ 6X NEW,3158,56.01
11832,CONVERSE ALL STAR YOUTH GIRLS SHORT SLEEVE PURPLE/ORANGE T-SHIRT SZ XL 13-15 YRS,11832,49.66
13387,"ROXY GIRL Size XL 14  White Tee ""HEAR IT NOW"" NWT",13387,37.25
474,*NWT GYMBOREE* Girls CIAO PUPPY White City Scooter Tee Top Size 5,474,60.91
12823,OshKosh Original Girls Patriotic Happy And Free Shirt Red Glitter 8 NWT!,12823,33.59
9399,Art Class Girls Size XL Short Sleeve Graphic Tee Shirt Tie or Shark Bite Yellow ,9399,44.65
14783,NWT ENERGY ZONE Aqua & Black SHORT SLEEVE Pullover Size 6-6X Girl,14783,18.65
2713,NWT Girls Justice Black Short Sleeve Top w/Different Pictures,2713,56.01
7624,NWT Girl sz 16 1/2 SHIRT SO brand stretch White BLACK PALM TREES,7624,44.84
8657,GYMBOREE BONJOUR BRIGHT BLACK w/ BIRD Tres Chic S/S TEE 5 6 7 8 10 NWT,8657,30.79
14796,"So Jenni Purple ""Born 2-B a Star"" Girls T-Shirt size 6 NWT G82606",14796,37.33
8336,NWT Lularoe Multi Color Print Bianka Open Front Sz 3 (L/XL),8336,56.01
128,"~NEW~ ""BEST BIG SISTER #1"" Girls Graphic Shirt 4 4T XS 5-6 Small 7-8 Medium GIFT",128,69.47
2620,NWT Athlete Girls Heather Gray Cap Sleeve Tie Front Won't Stop Tee sz XS 6,2620,74.73
2865,SAVED BY THE BELL Juniors Girls Kids Short Sleeve T-Shirt RED SAVED,2865,74.7
510,"Lot of 10- The Children's Place Big Girls' Short Sleeve Top, Green Bay, S (5/6)",510,74.7
5687,The Children's Place Girl's Dad Is My Hero S/S Graphic Tee AB4 Pink Medium NWT,5687,43.68
10514,HURLEY SPARKLE INK PALM SURF PINK YOUTH GIRL'S SHIRT SIZE XL (13-15 YRS) ,10514,53.21
1285,BeeEasy California Girl Big Wave NWT womens t shirt Size L Surf & Shore 50/50,1285,82.17
9599,AIR JORDAN JUMPMAN RETRO DOTS GRAPHIC SHORT SLEEVE GREY T-SHIRT SZ S (8-10 YRS) ,9599,56.76
5436,New Girls Coral Orange DC Comics Supergirl Hero Superman Shirt Size Small 6-6X,5436,44.8
687,Licensed MGA LOL Surprise Choose 1 Girls T Shirt Tee Glitterati Doll Ball NEW,687,56.01
2677,New Princess Hello Kitty Tulle Ruffle Layer Tunic Top Size 6 kid NWT RV $26 ,2677,44.84
14542,Dora The Explorer Girls Shirt 4 5 6 Lavender Purple NWT,14542,18.65
6408,NWT LuLaRoe Gracie Shirt Solid Rare Blue Horsey Print Size 4 Short Sleeve Youth,6408,112.1
7218,NWT GYMBOREE DESERT DREAMS BLUE  DESERT GLAM KITTY TOP TEE SHIRT SZ 5,7218,56.01
12165,GIRLS 5 SWEET PINK EMPIRE WAIST MULTICOLOR STAR RHINESTONE SHIRT NWT GARANIMALS,12165,18.65
6448,Gymboree Mermaid Cove Sequin Seastar MAKE WAVES White Shirt 5 Kid Girls NWT,6448,40.92
8020,GIRL S 6 7 GRAY S/S SHIRT BEAUTIFUL GOLD OUTLINED BUTTERFLIES NWT ~ OLD NAVY,8020,26.12
15986,4T Minnie Mouse Black Disneyland Tee Shirt NWT,15986,48.2
8909,Trolls girls 6X blue top,8909,29.89
10600,Under Armour Girls Shirt Girls Run The World Pink Size Medium Short Sleeve NWT ,10600,67.07
39,UNICORN & BUTTERFLY CHILD T-SHIRT THE MOUNTAIN,39,51.49
10503,NEW Girls Blouse Large 10 - 12 Hi-Low Top Coral Gray Striped T-Shirt Lace Sheer,10503,21.6
13351,Duck Dynasty Pink Forget Dolls I Want Duck Calls Kids Graphic T-Shirt XS D6,13351,63.52
13796,"Hello Kitty girls tops T-Shirt Various Styles & Sizes 4-5,6-6X,7-8,10-12, NWT",13796,33.97
15536,"Royal Buzz Girls Blouse: Pink or Black Polka Dot & Pink or Green Peace 4, 5, 6",15536,9.34
4743,New Proud American Girls Red Short Sleeve Sequin T-Shirt Freedom is Sweet,4743,22.23
13879,"Gymboree Girls Size XL (14), Ice Cream Short Sleeve Striped Tee Shirt",13879,33.63
13558,Steve & Barry's Classic Hawaiian Shirt! Size Large,13558,37.33
13767,Old Navy Girls LOVE T-Shirt Size XL/14 Brand New w/Tags,13767,18.65
10563,"DC HERO ""SUPERGIRL STRONGER THAN EVER"" TURQUOISE & PINK GIRLS SHIRT SZ 5 (4-5YRS",10563,49.66
1897,Brand New Izod Navy Polo Top Size Large 12/14,1897,53.21
14226,L.E.I. GIRL'S 'STINGERS' TOP/SIZE EXTRA LARGE/NEW WITH TAG,14226,13.04
11899,"Layer 8 Girls' Athletic V-Neck Top, Purple/Black, Size S, MSRP $22",11899,37.33
8723,Nike Any Time Any Place Blue Short Sleeve Tee T Shirt Youth Girls Large 14 NWT,8723,70.03
11969,NEW Girls Graphic T-Shirt Size XS 4 - 5 Gray Minions Despicable Me Movie Funny,11969,29.82
4409,GAP Kids Star Wars Black Darth Vader Rule The Galaxy Sequin Shirt M 8 NWT $27,4409,53.77
15669,Disney Girls Elsa Lace Raglan Graphic T-Shirt whtelsa 2T - Toddler,15669,41.93
3148,"Belle Du Jour Girls' 2-Piece I Speak Mermaid T-Shirt & Scarf Set,Size M MSRP $28",3148,52.28
3589,Nike Short Sleeve T-Shirt Dark Voltage Green Just Do It Casual Sports Girls 6,3589,52.13
9268,New ! Girls' Short Sleeve Halloween Creepin It Real T-Shirt - Cat & Jack Orange,9268,37.18
7301,NEW! NIKE GIRLS ACTIVE DRI-FIT SHORT SLEEVE TEE YELLOW SIZE (4),7301,41.07
2516,GUESS Girls Lace Tunic Ruffled Top White Floral 100% Cotton XL 16,2516,130.78
3430,Grateful Dead - Wagon Daisy Youth T-Shirt,3430,82.02
12923,Gap Kids NWT Top Size L 10 Pale Lavendar Short Sleeved Spring Summer ,12923,33.59
3169,SAVED BY THE BELL Juniors Girls Kids Short Sleeve T-Shirt NATURAL AZTEC TIGERS,3169,74.7
8153,Descendants birthday shirt Mal and Evie birthday shirt ,8153,56.01
15998,Dockers NEW Navy Blue Girl's Size 12-14 Seamed Gathered Solid Polo Shirt #683,15998,59.68
6959,Girls tween Matilda Jane The Adventure begins Be Right Over Tee Size 12 NWT,6959,152.83
14422,DC Shoes Boys Spray Star Tee (L) Charcoal ADBZ000006,14422,38.11
365,Santa Riding Unicorn - Youth Girl Short Sleeve Curved Hem Tee,365,74.7
8629,NEW Girls 2 pc Blouse Large 10 - 12 Pink Tank Top Blue Cold Shoulder Knit Shirt,8629,23.47
4684,"AQUA Girls’ Plaid Shirt , Black/White ,Size L, MSRP $40",4684,59.75
4907,Aeropostale Girl's Nineteen Eighty 7 Classic Crew Graphic Tee AB4 Purple Large,4907,42.0
15935,Nautica 36NDA0319Q-100-P6 Big Girls Short Sleeve Fashion Tee- Choose SZ/Color.,15935,62.7
13965,CAPTAIN AMERICA BOYS GRAPHIC T-SHIRT SIZE 8/10 RED WHITE NWT,13965,26.08
11360,Gymboree Tee Tropical Bloom Size 10 Girls Surf Club Cotton Blue New with Tag,11360,29.71
15539," NEW! Girls Novelty t-shirt Large ""Not Your Average Chick""",15539,17.56
11828,Crazy 8 by Gymboree sparkle shells top size 7-8 10-12 14,11828,37.33
1031,NWT Gymboree Desert Dreams Ice Cream Tee Shirt Top Girls 6 7,1031,48.24
15987,ZARA GIRLS T-SHIRT STRIPED WITH SHINY APPLIQUÉ 100% COTTON RED/WHITE SZ 6 NWT,15987,33.63
9638,SKECHERS GIRLS SIZE 8 10 TOP NWT SPRING FESTIVAL HUMMINGBIRD SHIRT RHINESTONES,9638,47.61
14525,Miami Beach Florida Little Girls T-Shirt Green Alvin's Island Size 5T NWT,14525,37.33
12175,DISNEY MINNIE MOUSE GLITTER STRIPE CROP TOP SHIRT SZ 10/12 NWT,12175,30.23
12598,Oshkosh Originals-Girls-Tee Shirt Top-Size 5-Coral-NEW,12598,37.37
5808,NEW Disney Store Lion Guard Shirt Blue Size 7/8 Girls Lion King Organic Cotton,5808,49.74
15201,The Children's Place Girls' Clothing TShirts Tanks Dresses PJ's Shorts Outfits,15201,17.67
3437,LuLaRoe Gracie Pullover T Shirt Top Short Sleeve Red Orange Geometric Girls 14,3437,69.09
6477,GIRLS DC COMICS SUPERGIRL PATRIOTIC SHIRT TSHIRT TOP (red white blue)  6-6X,6477,48.54
7027,NEW 7 9 Cakewalk Europe $54 Girls Shirt Blouse Top Tunic Jersey Button Down Red,7027,63.49
16234,NWT ARIZONA Junior Girls SPARKLING GRAPE Favorite Polo SHIRT Size 18 1/2 ,16234,133.18
2345,"NWT Girls Justice Active Size 20 White & Blue Short Sleeve Top ""Los Angeles""",2345,48.54
7374,NEW Ralph Lauren Girl's Top Pink/Dark Blue Strip - Size 8-10,7374,36.43
6797,NEW GIRLS UA Under Armour BIG LOGO T-Shirt XL GRAY Red Camo HEATGEAR Loose,6797,55.86
7230,BNWT Beautiful Designer SONIA RYKIEL ENFANT Girls Black Silk Sleeveless Top  10,7230,485.73
15354,NWT Girls C9 by Champion Printed Tech T Shirt Youth S 6-6X Turquoise Duo Dry,15354,14.91
926,Lularoe Kids Gracie shirt Americana Size 14 Black Red Blue Stars Half Circles,926,102.95
14798,CANDIE'S GIRL Blue Sleeveless String Top Tee Youth Size XS / S 7-8 MSRP $36,14798,22.23
15504,New NWT tcp Childrens Place GREEN Varsity Sport Knit TOP Shirt Tee T Girls S 5 6,15504,18.65
12540,Follow Your Dream Shirt for Women | Motivational Aspire Cute Youth T Shirt,12540,22.38
5211,Green Bay Packers girls size 16 green top w/silver accentting,5211,37.37
15569,Mudd Girls Plus Size Ringer Graphic T-Shirt,15569,42.75
8719,Girls Kids Youth Under Armour T-Shirt NEW Short Sleeve White Lead Top Size 6X,8719,47.05
14943,Hanes Girls' Ribbed Scoop Neck Tank Top Shirt Sleeveless 100% Cotton Jersey K403,14943,32.06
4253," Crazy 8 Sleeveless T-shirt Sequins ""Smile"" Girls ",4253,57.92
7917,NEW! Girls ARIZONA Bright Orange & Pink Stripe CrewNeck Casual Shirt Size 5,7917,41.07
8099,Girl's Under Armour White Athletic Shirt Size 6-NWT,8099,63.49
11217,NWT - Girls Xersion Blue Short Sleeve Shirt Graphic Tee XXL 20.5 Plus No heart,11217,24.62
15231,NWT Girl's Twirl tshirt #Squadgoals Turquoise Size XS 4/5,15231,24.29
11011,Gymboree Girls Size 5 or 9 Most Valuable Princess Embellished Shirt New,11011,33.97
380,NWT DKNY T shirt GIRL size S (6-8 ?) pink,380,70.96
3351,NEW ORIGINAL DISNEYPARKS GIRLS 7/8 MEDIUM SHORT SLEEVE MICKEY FRIEND PINK BLOUSE,3351,93.23
2218,"Lily Bleu Girls' Leopard Print Sequin Heart Tee, Heather Gray, Size 4, ",2218,74.7
9296, Girls ATHLETIC CHICKS RULE tee sz Small 5-6 Sports Tee,9296,41.55
15760,Hybrid Girls Pizza Party Graphic T-Shirt,15760,34.98
14213,Junior's Plus Size Swing Tee Shirt Lace up Neck Olive Leaf Eye Candy Sz 1X NEW,14213,33.97
4661,FINAL FIGHT Juniors Girls Kids Short Sleeve T-Shirt BLACK FF GANG,4661,74.7
13250,Gap Kids Girls Polo Shirt Uniform Pique Cotton Short Sleeve Button NWT Large 10,13250,37.33
195,Columbia Silver Ridge Short Sleeve Tee Shirt Girl's,195,59.75
16488,Berek Rare Girl's Yellow Monkeys Fruits Button-Down Short Sleeve Cardigan 6X NWT,16488,224.2
5640,Gap Kids NEW  Girls size 8 tweety bird shirt ,5640,93.38
9194,GIRLS L 10-12 MINT GREEN DREAM BIG LAUGH & LOVE CURVED HEM SHIRT NWT~ OLD NAVY,9194,33.59
6735,10016922 Ariat Girl's Hashtag Tee Short Sleeve - Navy & White NEW,6735,70.96
8254,Wishful Park Girls Top Size 12 Green White Cami Overtop Two Piece Back to School,8254,61.99
12134,Nike Girls FEAR MY AWESOME Short Sleeve Shirt 885091 - Purple 520 - Size L - NWT,12134,37.33
11222,New Epic Threads Youth Girl's Shirt Medium 10/12 Top Brown with Pink Flowers,11222,63.49
8009,NWT NEW Burberry Gisselle pink blue T-shirt nova check cuffs 5y 8y 10y 12y 14y,8009,220.47
10102,Circo Patriotic Shirts 4 5 Lot of Two for Children Pawtriot USA Patriot America,10102,29.86
16410,LOT of 3 GIRL XL 14-16  t-shirt top solid color CORAL*WHITE*BLACK crew / v-neck,16410,55.94
5963, LuLaRoe Bianka  Floral Open Front Top Kimono Cardigan Sz 3 (10-12) Girls Kids,5963,112.03
5139,CATS CRADLE CHILD T-SHIRT THE MOUNTAIN,5139,51.49
8388,NWT Gymboree Fairy Fashionable Stripe Tee Top 4 4T,8388,44.65
11231,Everlast Girls Sport Shirt Size 7/8 Active Fitness Top Brand New,11231,26.12
7552,GYMBOREE RED WHITE & CUTE WHITE w/ AMERICANA GIRLS/S TEE 4 5 6 NW,7552,27.99
9564,NWT THE CHILDRENS PLACE TCP GIRLS SIZE 7 8 TOP PURPLE SMOCKED YELLOW FLOWERS NEW,9564,47.61
7322,NWT Gymboree Posh and Playful Size 6 White City Scene Rayon Shirt Top,7322,119.61
9764,New girls NFL medium 10-12 top shirt NY Jets football NFL team apparel ,9764,26.87
8686,"NWT ARIZONA GIRLS S/S NAVY KNIT TOP W/""PEACE"" WRITTEN IN FLOWERS 10-12",8686,38.3
10855,Girl BLACK Star Graphic WHITE T Shirt  Short Sleeve  CAMISA DE NINA C8,10855,33.59
7080,JOE FRESH - GIRLS - TOP - GRAY - SIZE LARGE   (HM-BX-131-3x4),7080,48.39
14445,Claire's Blue Girls T-Shirt Cody Simpson Size Large,14445,22.42
10379,MTA Sport Girls Size Polyester Fast Dri Short Sleeve Activewear Raglan Tee NEW,10379,17.56
2831,NEW SANRIO HELLO KITTY PINK TOP TEE SIZE 4 6X,2831,65.39
15801,Dream Star Girls Fuchsia & Pink Cat Crocheted Top Size 5 $24,15801,48.54
14225,NWT Nike Volt Ice neon yellow purple Run the Future bunny rabbit top shirt 4,14225,33.63
16421,NWT NEW Burberry girls Zadie white red polo shirt nova check collar 10y,16421,269.04
14150,"Cute Girl's ""RoeBuck & Co."" Shirt Size 14 (Brand New)",14150,25.41
14352,Girl's Disney Frozen knit tee Size 4/5,14352,22.38
8601,"GIRLS DISNEY T-SHIRTS FROM THE MOVIE  ""FROZEN""  SIZES 4/5(XS) THRU 14/16  NWT",8601,41.07
15407,AMY BYER Girls L-14 White Dressy Shirt Wide Sleeves Band Waist NWT Bead Necklace,15407,18.68
805,GIRAFFE SELFIE CHILD T-SHIRT THE MOUNTAIN,805,51.49
2361,NEW GAP DROP WAIST FLORAL TOP SIZE S 6/7 M 8 L 10,2361,61.66
12741,Relax Take Thyme Funny Shirt | Home Gardening Gift Idea Cool Youth T Shirt,12741,21.97
14147,Roxy Kids Sz 5 Shirts Tops Heart of The Sea,14147,59.75
7879,"Youth Girls Fifth Sun Totes Adorbs Shirt New Size 4, 5-6, 7-8. 10-12, 14-16",7879,26.12
12411,Listen to Heart Cute Shirt for Women | Couple Valentine Day Youth T Shirt,12411,22.38
9958,NWT Gymboree Seaside Stroll Size 8 Blue Silver Trim Peplum Shirt Top,9958,61.66
4267,PATRIOTIC KITTEN CHILD T-SHIRT THE MOUNTAIN,4267,51.49
14471,NWT Girls 5 - Nike Shirt - Dream Big,14471,33.44
15551,"Girl's Duck Dynasty Pink 100% Cotton T-Shirt ""Camo is My Favorite Color "" XS 4 5",15551,26.16
7740,Girls Kids Youth Under Armour T-Shirt NEW Short Sleeve Purple Top Size 4,7740,50.41
7355,Girl's Brushy Phrase Shirred Sideseam LS Tee HNK368,7355,53.47
13990,SHOPKINS What's Not To Love Kids' Tee Girls size 7/8 M NEW,13990,37.33
4804,NEW MOSCHINO TEEN GIRLS FLEECE COTTON SWEATSHIRT TUNIC TOP SIZE 10 - 140cm,4804,130.78
9878,Girls Size 8 Clothes One Direction ID Green T-Shirt/Top NWT $26 Justice,9878,26.16
10548,"Under Armour Girls ""This is Girl Power"" Foil Graphic Tee Shirt Top in Purple (M)",10548,93.38
307,Justice Girls Size 18-20 Crochet Kimono in Navy Blue New with Tags,307,90.76
794,New Authentic Junk Food The Beatles Hard Days Night Girls T-Shirt in Black,794,65.39
16452,"L.e.i. Girls Pink Heart Print Short Sleeve Shirt w/ Black Suede Vest, L 10/12",16452,67.26
13547,NEW Tie Dye JUSTICE Swingy Top Tee SHIRT Blue Pink Size 6 7 10 12 NWT,13547,28.03
11898,Soffe Girls Classic Raglan Sleeve Stripes Retro Football V Neck T Shirt. 6569G,11898,104.96
3277,BAYWATCH Juniors Girls Kids Short Sleeve T-Shirt YELLOW HEATHER DAVE,3277,74.7
4664,STREET FIGHTER Juniors Girls Kids Short Sleeve T-Shirt BLACK ALLEY FIGHT,4664,74.7
294,Justice Girl's NEW YORK Flip Sequin Destination Tee Size 8 New with Tags,294,84.04
8704,NWT Youth Girls UNDER ARMOUR shirts size: Large Wonder Women Very Nice!,8704,59.75
10104,NWT Girls Pink Short Sleeve Minnie Mouse Top Small 6/6X,10104,23.24
